Category Name,Category ID,Kink ID,Translation Key,Label,Tooltip
Corps,bodies,skinny,bodies.skinny,Maigre,"Intéressé par les personnages minces, minces ou élancés."
Corps,bodies,chubby,bodies.chubby,Joufflu,"Intéressé par des personnages plus ronds, corsés et dodus."
Corps,bodies,small_breasts,bodies.small_breasts,Petits seins,"Intérêt pour les seins exceptionnellement petits, parfois au point qu’ils semblent presque absents."
Corps,bodies,large_breasts,bodies.large_breasts,Gros seins,Intéressé par les seins exceptionnellement gros.
Corps,bodies,small_cocks,bodies.small_cocks,Petites bites,Intéressé par des pénis plus petits que la moyenne.
Corps,bodies,large_cocks,bodies.large_cocks,Grosses bites,Intéressé par des bites plus grosses que la moyenne.
Corps,bodies,small_butts,bodies.small_butts,Petites fesses,Intéressé par les fesses particulièrement petites.
Corps,bodies,big_butts,bodies.big_butts,Grosses fesses,Intéressé par les fesses particulièrement grosses.
Vêtements,clothing,clothed_sex,clothing.clothed_sex,Sexe avec des vêtements,Participer à un RP où vous et/ou votre partenaire n'êtes pas déshabillés pendant l'interaction sexuelle.
Vêtements,clothing,lingerie,clothing.lingerie,Lingerie,"Intérêt pour l'utilisation de la lingerie dans le contexte sexuel d'un RP, ou intérêt pour les personnages qui la portent."
Vêtements,clothing,stockings,clothing.stockings,Bas,"Intérêt pour l'utilisation de bas dans le contexte sexuel d'un RP, ou intérêt pour les personnages qui les portent."
Vêtements,clothing,heels,clothing.heels,Talons,"Intérêt pour l'utilisation de talons hauts dans le contexte sexuel d'un RP, ou intérêt pour les personnages qui les portent."
Vêtements,clothing,leather,clothing.leather,Apprendre,"Intéressé par l'utilisation de vêtements en cuir dans le contexte sexuel d'un RP, ou intéressé par les personnages qui les portent."
Vêtements,clothing,latex,clothing.latex,Latex,L'utilisation de latex et/ou de caoutchouc porté comme vêtement.
Vêtements,clothing,uniform_costume,clothing.uniform_costume,Uniforme / costume,"Intérêt pour l’utilisation d’uniformes ou de costumes dans le contexte sexuel d’un RP, ou intérêt pour les personnages qui les portent."
Vêtements,clothing,cross_dressing,clothing.cross_dressing,Travestissement,Participer à un RP où un ou plusieurs personnages s'habillent avec des vêtements du sexe opposé.
Général,general,handjob_fingering,general.handjob_fingering,Branlette / Doigté,Stimulation sexuelle par contact physique direct des mains ou des doigts avec les organes génitaux.
Général,general,oral,general.oral,Oral,Stimulation sexuelle par contact physique direct de la bouche ou de la langue avec les organes génitaux.
Général,general,deep_throat,general.deep_throat,Gorge profonde,"Pénétrer la bouche d'un autre personnage jusqu'à la profondeur où le pénis ou l'objet inséré pénètre dans le fond de la cavité buccale et/ou de la gorge, provoquant parfois un réflexe nauséeux, ou recevant de tels actes."
Général,general,swallowing,general.swallowing,Avaler,"La consommation orale de sperme ou l'éjaculation, directement ou indirectement, à partir d'un organe génital."
Général,general,facials,general.facials,Soins du visage,L'acte d'éjaculer/gicler directement sur le visage de quelqu'un.
Général,general,face_sitting,general.face_sitting,Assis sur le visage,"Une pratique sexuelle dans laquelle quelqu'un s'assoit avec ses fesses ou ses parties génitales sur le visage d'un autre personnage, étouffant la personne, parfois jusqu'au point de l'étouffer ; souvent utilisé comme une forme de coercition pour une gratification orale."
Général,general,edging,general.edging,Bordure,Rester au bord de l'orgasme sans avoir d'orgasme.
Général,general,teasing,general.teasing,Les fléaux,"Désigne des scènes prolongées de préliminaires avant un rapport sexuel explicite, qui peut être physique et/ou verbal, généralement pour exciter le partenaire jusqu'au point de frustration ou de désespoir sexuel."
Général,general,ruined,general.ruined,Ruiné,"L'acte de permettre à une personne d'avoir un orgasme, mais d'arrêter la stimulation juste avant l'orgasme, ce qui entraîne un orgasme incomplet ou insatisfaisant. Cela peut se produire aussi bien avec des partenaires masculins que féminins."
Jeu anal,ass_play,anal_toys,ass_play.anal_toys,Jouets anaux,"Désigne la pénétration anale avec des jouets sexuels, y compris, mais sans s'y limiter, les godes, les vibromasseurs, les œufs anaux, les perles anales, etc."
Jeu anal,ass_play,anal_sex_pegging,ass_play.anal_sex_pegging,Sexe anal/pegging,"Être pénétré par un partenaire, avec un pénis ou un gode ceinture."
Jeu anal,ass_play,rimming,ass_play.rimming,Anulingus,Fournir une stimulation orale à l'anus d'un partenaire en léchant et/ou en pénétrant l'anus du receveur avec la langue.
Jeu anal,ass_play,double_penetration,ass_play.double_penetration,Double pénétration,"Pénétrer ou recevoir l'anus d'un seul personnage avec deux objets, y compris, mais sans s'y limiter, le pénis, les jouets sexuels, le poing, etc."
Jeu anal,ass_play,anal_fisting,ass_play.anal_fisting,Fisting anal,"Insérer sa ou ses mains et/ou son ou ses bras dans l'anus de son partenaire, ou recevoir de tels actes."
Restrictif,restrictive,collar,restrictive.collar,Collier,Porter un collier autour du cou.
Restrictif,restrictive,leash,restrictive.leash,Ceinture,Être mené en laisse.
Restrictif,restrictive,chastity,restrictive.chastity,Chasteté,"Abstinence sexuelle, volontaire ou forcée ; Cela peut impliquer qu’une personne s’abstienne simplement d’activité sexuelle ou porte un dispositif qui l’empêche."
Restrictif,restrictive,bondage_light,restrictive.bondage_light,Bondage (Lumière),"L'utilisation d'un bondage léger ou modéré, que ce soit dans la position dans laquelle il place le personnage lié, la durée pendant laquelle le personnage sera en esclavage, le niveau d'inconfort causé par l'esclavage ou le degré d'immobilisation qui se produira à la suite de l'esclavage."
Restrictif,restrictive,bondage_heavy,restrictive.bondage_heavy,Bondage (lourd),"L'utilisation d'un bondage extrême, que ce soit dans la position dans laquelle il place le personnage lié, dans la durée pendant laquelle le personnage sera en esclavage, dans le niveau d'inconfort causé par le bondage ou dans le degré d'immobilisation qui se produira à la suite du bondage."
Restrictif,restrictive,encasement,restrictive.encasement,Confinement,"Le corps entier est enveloppé comme une momie dans une combinaison en latex, un sac de couchage ou un autre équipement fétichiste pour la satisfaction sexuelle."
Restrictif,restrictive,cag,restrictive.cag,Chasteté/cages,Un dispositif qui empêche l’accès aux organes génitaux.
Restrictif,restrictive,blindfold,restrictive.blindfold,Bandeau,"Couvrir les yeux pour obstruer la vision, ce qui peut accentuer d’autres sens et accroître le sentiment de vulnérabilité."
Restrictif,restrictive,breast_bondage,restrictive.breast_bondage,Bondage des seins,"Techniques de bondage spécifiques qui consistent à attacher les seins, ce qui peut augmenter la sensibilité et être visuellement stimulant."
Restrictif,restrictive,rope_simple,restrictive.rope_simple,Bondage à la corde (simple),Techniques de base de bondage à la corde pour restreindre les membres ou restreindre les mouvements.
Restrictif,restrictive,rope_shibari,restrictive.rope_shibari,Bondage à la corde (Shibari),Art japonais complexe et esthétique de la reliure en corde qui combine à la fois des limitations fonctionnelles et une expression artistique.
Restrictif,restrictive,spreader_bars,restrictive.spreader_bars,Barres d'écartement,"Barres utilisées pour maintenir les membres écartés, facilitant l'accès et augmentant la vulnérabilité."
Restrictif,restrictive,suspension,restrictive.suspension,Suspension,"Techniques de bondage où le corps est partiellement ou complètement soulevé du sol, créant une sensation unique d'apesanteur et d'abandon complet."
Restrictif,restrictive,mummification,restrictive.mummification,Momification,"Envelopper complètement le corps dans des matériaux tels que du film plastique, du ruban adhésif ou du latex, ce qui entraîne une immobilisation quasi complète."
Restrictif,restrictive,sensory_deprivation,restrictive.sensory_deprivation,Privation sensorielle,"Limiter ou éliminer les informations sensorielles, telles que la vue, l’ouïe ou le toucher, pour améliorer d’autres sens et approfondir la concentration."
Restrictif,restrictive,armbinders,restrictive.armbinders,Reliures à bras,"Tubes spéciaux qui fixent les bras derrière le dos, provoquant une immobilisation complète des bras."
Restrictif,restrictive,cages,restrictive.cages,Cages,Être enfermé dans une cage ou une cellule comme une forme de servitude et de dynamique de pouvoir.
Restrictif,restrictive,chains,restrictive.chains,Chaînes,"Être attaché avec des chaînes, ce qui donne une sensation unique de lourdeur et de froid par rapport aux autres matériaux de bondage."
Restrictif,restrictive,leather_cuffs,restrictive.leather_cuffs,Menottes en cuir,Menottes en cuir pour attacher les poignets ou les chevilles.
Restrictif,restrictive,metal_cuffs,restrictive.metal_cuffs,menottes en métal,Menottes traditionnelles en métal utilisées pour lier les poignets ou les chevilles.
Restrictif,restrictive,gag_ball,restrictive.gag_ball,Balgag,Un bâillon en forme de boule qui est placé dans la bouche et fixé derrière la tête.
Restrictif,restrictive,gag_ring,restrictive.gag_ring,Bâillon-anneau,"Un bâillon en forme d'anneau qui maintient la bouche ouverte, permettant l'accès à la bouche tout en empêchant la parole."
Restrictif,restrictive,gag_tape,restrictive.gag_tape,Bâillon à ruban adhésif,Ruban adhésif utilisé pour couvrir la bouche et empêcher la parole.
Restrictif,restrictive,hoods,restrictive.hoods,Capuches,"Couvre-chef complet pouvant créer un sentiment d’anonymat, de dépersonnalisation ou de privation sensorielle."
Restrictif,restrictive,immobilisation,restrictive.immobilisation,Immobilisation,Restriction complète des mouvements par diverses techniques de bondage.
Restrictif,restrictive,leather_restraints,restrictive.leather_restraints,poignets en cuir,"Diverses menottes en cuir, utilisées pour différentes formes de bondage."
Restrictif,restrictive,stocks,restrictive.stocks,pilori,Dispositif de restriction médiéval traditionnel qui maintient la tête et les mains.
Restrictif,restrictive,straight_jacket,restrictive.straight_jacket,Camisole de force,Un vêtement spécial conçu pour immobiliser les bras en les liant au corps.
Restrictif,restrictive,sleep_sack,restrictive.sleep_sack,Sac de couchage,"Un sac spécial et étanche dans lequel tout le corps est enfermé, semblable à la momification."
Jouets,toys,dildos,toys.dildos,Godemichés,Un objet en forme de pénis en érection utilisé pour la stimulation sexuelle.
Jouets,toys,plugs,toys.plugs,Bouchons,Un jouet sexuel conçu pour être inséré dans le rectum.
Jouets,toys,vibrators,toys.vibrators,Vibromasseurs,Un appareil vibrant utilisé pour la stimulation sexuelle.
Jouets,toys,sounding,toys.sounding,Sondage,"L'insertion de tiges métalliques dans l'urètre d'un homme ou d'une femme, ou la réception de tels actes ; implique techniquement des tiges qui résonnent et/ou vibrent en réponse à une certaine forme de stimulation, mais cela ne signifie pas nécessairement cela."
Dominance,domination,dd_lg_md_lb,domination.dd_lg_md_lb,"DD/lg, MD/lb","Papa ou Maman Dom/Petite Fille ou Garçon. Le papa/maman est la moitié la plus dominante de la relation, le petit est le plus soumis."
Dominance,domination,domestic_servitude,domination.domestic_servitude,Service domestique,"Être servi par un majordome, une serveuse, un chauffeur, une femme de ménage ou une gouvernante, ou servir à ce titre."
Dominance,domination,slavery,domination.slavery,Esclavage,"Servir comme esclave aux ordres du dominant, ou recevoir un tel service, sans choix."
Dominance,domination,pet_play,domination.pet_play,Jeu d'animaux de compagnie,"Le jeu d'animaux de compagnie est un rôle dans lequel l'accent est mis sur le soumis qui adopte un état d'esprit alternatif, souvent celui d'un chien, d'un chat ou d'un cheval."
Dominance,domination,begging,domination.begging,Mendier,"L'acte autodégradant de mendier, comme forme de soumission, qui est incorporé dans un RP."
Dominance,domination,discipline,domination.discipline,Discipline,L'utilisation de renforcement (récompenses et/ou punitions) pour entraîner un soumis à obéir aux différents ordres d'un maître.
Dominance,domination,forced_orgasm,domination.forced_orgasm,Orgasme forcé,Un orgasme forcé est un jeu sexuel BDSM ou pervers consensuel dans lequel une personne consent à être forcée à avoir un orgasme d'une manière indépendante de sa volonté.
Dominance,domination,orgasm_denial,domination.orgasm_denial,Abstinence d'orgasme,Fait référence au dominant refusant au soumis un orgasme.
Dominance,domination,multiple_orgasms,domination.multiple_orgasms,Orgasmes multiples,"Forcer ou vivre plusieurs orgasmes successifs, parfois jusqu'à la surstimulation ou l'épuisement."
Dominance,domination,orgasm_training,domination.orgasm_training,Entraînement à l'orgasme,"Entraîner un soumis à venir sur commande, ou à venir uniquement avec la permission du dominant."
Pas de consentement,no_consent,dubious_consent,no_consent.dubious_consent,Consentement douteux,"Situations dans lesquelles le consentement du partenaire est remis en question, même s'il ne s'agit pas d'un viol pur et simple."
Pas de consentement,no_consent,non_con_rape,no_consent.non_con_rape,Non-con/viol,"Prendre/être pris contre sa volonté, souvent par la force."
Pas de consentement,no_consent,blackmail_coercion,no_consent.blackmail_coercion,Chantage / coercition,"Désigne l'utilisation de la coercition et/ou du chantage dans le contexte de l'histoire d'un RP, souvent sous la forme d'un moyen semi-consensuel pour obtenir des relations sexuelles avec un partenaire."
Pas de consentement,no_consent,kidnapping,no_consent.kidnapping,Enlèvement,"Enlever un personnage dans un RP dans le but de l'abuser, souvent sexuellement, ou être kidnappé pour de telles raisons ; implique souvent un emprisonnement indéfini."
Pas de consentement,no_consent,drugs,no_consent.drugs,Drogues,"L'utilisation de drogues illégales dans le contexte d'un RP, généralement pour désorienter ou neutraliser mentalement un personnage, ou pour intensifier les sensations sexuelles."
Pas de consentement,no_consent,alcohol,no_consent.alcohol,Alcool,"L'utilisation d'alcool dans le contexte d'un RP, généralement pour désorienter ou neutraliser mentalement un personnage, ou pour intensifier les sensations sexuelles."
Pas de consentement,no_consent,sleep_play,no_consent.sleep_play,Jeu de sommeil,Se livrer à des actes sexuels avec un partenaire inconscient ou endormi.
Tabou,taboo,incest,taboo.incest,Inceste,Participez à un RP où au moins deux personnages sont liés.
Tabou,taboo,age_gap,taboo.age_gap,Différence d'âge,Désigne les scènes dans lesquelles il existe une différence significative dans l’âge des personnages.
Tabou,taboo,interracial,taboo.interracial,Interracial,Scènes basées sur des interactions interraciales sans s'appuyer sur des stéréotypes raciaux.
Tabou,taboo,raceplay,taboo.raceplay,Jeu de course,"Scènes basées sur des stéréotypes raciaux ou sur le racisme, y compris des scènes se déroulant dans des contextes racistes."
Tabou,taboo,bestiality,taboo.bestiality,Bestialité,"Désigne un personnage sensible effectuant un acte sexuel sur un animal non sensible, ou jouant un animal non sensible dans un RP et étant approché par un personnage sensible."
Tabou,taboo,necrophilia,taboo.necrophilia,Nécrophilie,"L'acte d'avoir des relations sexuelles avec un personnage mort, ou autrement inconscient ou inanimé, qui était autrefois en vie, ou, théoriquement, de recevoir de tels actes."
Tabou,taboo,cheating,taboo.cheating,Tricherie,Lorsque l’un ou les deux partenaires sont infidèles à leur partenaire.
Tabou,taboo,exhibitionism,taboo.exhibitionism,Exhibitionnisme,Participer à un RP où le cadre est de nature publique ; généralement utilisé en combinaison avec l'exhibitionnisme et/ou l'humiliation.
Tabou,taboo,voyeurism,taboo.voyeurism,Voyeurisme,"Désigne l'obtention d'une stimulation sexuelle soit par l'acte d'observer, généralement en secret, une personne (ou des personnes) se dévoiler ou faire quelque chose d'autre d'explicite, soit par l'acte de se dévoiler et/ou de faire quelque chose d'autre d'explicite avec l'intention d'être observé."
Surréalisme,surrealism,futanari_futa,surrealism.futanari_futa,Futanari/Futa,"Personnages qui ont un corps généralement féminin, mais qui ont des organes génitaux féminins et masculins (bien que les testicules ne soient pas toujours présents)."
Surréalisme,surrealism,furry,surrealism.furry,Velu,Personnages animaux anthropomorphes.
Surréalisme,surrealism,vore,surrealism.vore,Sillon,L'acte de consommer physiquement un autre personnage.
Surréalisme,surrealism,transformation,surrealism.transformation,Transformation,"L'acte de provoquer des changements spectaculaires des caractéristiques physiques d'un participant à un RP, y compris éventuellement de soi-même, par des moyens magiques ou chimiques ; peut faire référence à un certain nombre de types différents de transformations et indique que l'on reçoit du plaisir sexuel de l'acte de transformation lui-même."
Surréalisme,surrealism,tentacles,surrealism.tentacles,Tentacules,Participer à un RP dans lequel des tentacules conscients d'eux-mêmes ou des appendices ressemblant à des tentacules pénétreront un personnage ; implique souvent des pénétrations multiples.
Surréalisme,surrealism,monster_or_alien,surrealism.monster_or_alien,Monstre ou extraterrestre,"Différents types de monstres, d'extraterrestres et de personnages esthétiquement difficiles."
Surréalisme,surrealism,ghost,surrealism.ghost,Esprit,"Autrefois en vie, mais actuellement sans corps."
Liquides,fluids,blood,fluids.blood,Sang,"Relatif au prélèvement de sang ou à l'obtention de sang sous quelque forme que ce soit dans un contexte sexuel, ou à l'exécution d'actes qui entraîneront une prise de sang."
Liquides,fluids,watersports,fluids.watersports,Sports nautiques,"Désigne l'acte d'inhaler de l'urine, ou l'expulsion d'urine, sous quelque forme que ce soit, dans le contexte sexuel d'un RP."
Liquides,fluids,scat,fluids.scat,Scat,Désigne l'ingestion d'excréments ou l'expulsion d'excréments sous quelque forme que ce soit dans le contexte sexuel d'un RP.
Liquides,fluids,lactation,fluids.lactation,Lactation,"Produire du lait à partir de ses seins, ou avoir des relations sexuelles avec un personnage qui produit du lait à partir de ses seins, généralement en réponse à une stimulation sexuelle, et tout jeu qui en résulte."
Liquides,fluids,diapers,fluids.diapers,Couches,"Une situation dans laquelle au moins un personnage portera une couche ; implique généralement que la couche sera souillée par de l'urine et/ou des excréments, généralement en combinaison avec des jeux liés à l'âge ou de l'infantilisme, mais parfois en combinaison avec de l'humiliation."
Liquides,fluids,cum_play,fluids.cum_play,Jeu de sperme,Un certain nombre de situations impliquant un jeu de sperme.
Liquides,fluids,saliva_spit,fluids.saliva_spit,Salive/crachat,Jeu sexuel avec de la salive ou de la salive.
Liquides,fluids,creampie,fluids.creampie,tarte à la crème,Éjaculer sur un partenaire et laisser le sperme couler ou s'écouler.
Liquides,fluids,cum_on_body,fluids.cum_on_body,Éjaculation sur le corps,Éjaculer sur le corps d'un partenaire comme forme de jeu sexuel.
Liquides,fluids,cum_on_face,fluids.cum_on_face,Éjaculation sur le visage,"L'acte d'éjaculer sur le visage d'un partenaire, parfois comme une forme de domination ou d'humiliation."
Humiliation,degradation,glory_hole,degradation.glory_hole,Trou de gloire,Servir ou être servi par un partenaire avec une barrière physique entre les participants.
Humiliation,degradation,name_calling,degradation.name_calling,Malédiction,"S'engager dans un RP dans lequel un personnage sera agressé verbalement, dans le but de susciter une réponse de gratification sexuelle à partir des émotions liées à l'humiliation, ou simplement comme une forme de domination psychologique ou de punition."
Humiliation,degradation,humiliation,degradation.humiliation,Humiliation,"S'engager dans un RP dans lequel un personnage sera embarrassé, généralement extrêmement et/ou fréquemment, dans le but de susciter une réponse de gratification sexuelle à partir des émotions liées à l'humiliation, ou simplement comme une forme de domination psychologique ou de punition ; généralement une forme de dégradation plus intense."
Toucher et stimulation,touch_stimulation,cock_pussy_worship,touch_stimulation.cock_pussy_worship,Culte du pénis/vagin,"Reconnaissance excessive des organes génitaux de votre partenaire, que ce soit verbalement et/ou physiquement, ou réception de tels actes ; implique généralement une stimulation orale."
Toucher et stimulation,touch_stimulation,ass_worship,touch_stimulation.ass_worship,Adoration des fesses,"Reconnaissance excessive des fesses de votre partenaire, que ce soit verbalement et/ou physiquement, ou réception de tels actes ; implique généralement une stimulation orale."
Toucher et stimulation,touch_stimulation,foot_play,touch_stimulation.foot_play,Jeu de pied,"L'utilisation des pieds dans le contexte sexuel d'un RP, y compris, mais sans s'y limiter, le culte des pieds, la réception d'une gratification sexuelle par la vue ou l'odeur des pieds et/ou le frottement des pieds, parfois jusqu'à l'orgasme."
Toucher et stimulation,touch_stimulation,tickling,touch_stimulation.tickling,Chatouillement,L'acte de chatouiller et/ou d'être chatouillé dans un contexte sexuel d'un RP ; ou en recevant une stimulation sexuelle.
Toucher et stimulation,touch_stimulation,sensation_play,touch_stimulation.sensation_play,Jeu de sensations,"Le jeu de sensations décrit un large éventail d'activités, à la fois classiques et coquines, qui utilisent les sens du corps comme moyen d'éveiller et de stimuler un partenaire. Bien que le jeu de sensations soit souvent lié aux sensations cutanées, il ne doit pas nécessairement être aussi limité. La vue, le goût et l’ouïe peuvent également être intégrés au jeu des sensations."
Toucher et stimulation,touch_stimulation,electro_stimulation,touch_stimulation.electro_stimulation,Électrostimulation,L’utilisation de jouets sexuels transportant un courant électrique ; parfois douloureux.
Toucher et stimulation,touch_stimulation,ice_play,touch_stimulation.ice_play,Jeu de glace,L'utilisation de la glace sur le corps pour les contrastes de température et la stimulation sensorielle.
Toucher et stimulation,touch_stimulation,temperature_play,touch_stimulation.temperature_play,Jeu de température,L'utilisation de différentes températures (chaud et froid) sur le corps pour la stimulation sensorielle et le contraste.
Toucher et stimulation,touch_stimulation,feather_play,touch_stimulation.feather_play,Jeu de plumes,L'utilisation de plumes pour des touches légères et douces qui peuvent chatouiller ou procurer une sensation sensuelle.
Toucher et stimulation,touch_stimulation,pinwheel,touch_stimulation.pinwheel,Moulinet,"Un instrument pointu en forme de roue (roue de Wartenberg) qui roule sur la peau, provoquant une sensation de picotement sans la briser."
Divers fétiches,misc_fetish,fisting,misc_fetish.fisting,Fisting,"Placer votre/vos main(s) et/ou bras dans un vagin, ou recevoir de tels actes."
Divers fétiches,misc_fetish,double_penetration,misc_fetish.double_penetration,Double pénétration,Pénétration de 2 godes ou pénis en même temps.
Divers fétiches,misc_fetish,gangbang,misc_fetish.gangbang,Gangbang,"Lorsque plusieurs partenaires, généralement 3 ou plus, ont des rapports sexuels avec un seul partenaire consentant."
Divers fétiches,misc_fetish,breath_play,misc_fetish.breath_play,Jeu de respiration,"Une situation dans laquelle au moins un personnage aura un contrôle physique sur les habitudes respiratoires d'un autre personnage, souvent par strangulation intermittente et/ou par pénétration de la gorge."
Divers fétiches,misc_fetish,impregnation,misc_fetish.impregnation,Fertilisation,Imprégner un personnage.
Divers fétiches,misc_fetish,pregnancy,misc_fetish.pregnancy,Grossesse,Fétichiser un personnage enceinte.
Divers fétiches,misc_fetish,feminization,misc_fetish.feminization,Féminisation,La féminisation est un type de jeu de rôle dans lequel des traits traditionnellement féminins sont imposés à un partenaire masculin soumis. Cela peut également impliquer une hypothèse de comportement et de manières féminines traditionnelles.
Divers fétiches,misc_fetish,cuckold_cuckquean,misc_fetish.cuckold_cuckquean,Cocu / Cuckquean,"Désigne l'acte d'un personnage qui, dans les limites du monde RP, est désigné pour être en relation, ayant une interaction sexuelle avec un personnage autre que celui qui est désigné pour être en relation, dans le contexte du RP."
Divers fétiches,misc_fetish,shaving,misc_fetish.shaving,Raser,L'épilation du corps dans un contexte sexuel.
Douleur,pain,light_pain,pain.light_pain,Douleur légère,Désigne l’ajout d’une légère douleur physique par des actes directement sexuels.
Douleur,pain,heavy_pain,pain.heavy_pain,Douleur intense,Désigne l’ajout d’une douleur physique intense par des actes directement sexuels ; pénétrations généralement brutales ou excessives. Cela laissera probablement une trace.
