Category Name,Category ID,Kink ID,Translation Key,Label,Tooltip
الإذلال,degradation,humiliation,degradation.humiliation,الإذلال,المشاركة في لعبة لعب الأدوار حيث تشعر الشخصية بالحرج، عادةً بشكل كبير و/أو متكرر، في محاولة لإثارة استجابة الإشباع الجنسي من المشاعر المرتبطة بالإذلال، أو مجرد شكل من أشكال الهيمنة النفسية أو العقاب؛ عادة ما يكون شكل أكثر كثافة من التدهور.
اللمس والتحفيز,touch_stimulation,cock_pussy_worship,touch_stimulation.cock_pussy_worship,عبادة القضيب/المهبل,التعرف المفرط على الأعضاء التناسلية لشريكك، سواء لفظيًا و/أو جسديًا، أو تلقي مثل هذه الأفعال؛ عادة ما ينطوي على التحفيز الفموي.
اللمس والتحفيز,touch_stimulation,ass_worship,touch_stimulation.ass_worship,عبادة المؤخرة,التعرف المفرط على أرداف شريكك، سواء لفظيًا و/أو جسديًا، أو تلقي مثل هذه الأفعال؛ عادة ما ينطوي على التحفيز الفموي.
اللمس والتحفيز,touch_stimulation,foot_play,touch_stimulation.foot_play,لعبة القدم,استخدام الأقدام في السياق الجنسي لـ RP، بما في ذلك على سبيل المثال لا الحصر عبادة الأقدام، والحصول على إشباع جنسي من رؤية أو رائحة الأقدام، و/أو مداعبة الأقدام، وأحيانًا إلى حد النشوة الجنسية.
اللمس والتحفيز,touch_stimulation,tickling,touch_stimulation.tickling,دغدغة,فعل الدغدغة و/أو الدغدغة في سياق جنسي لشريك الحياة؛ أو تلقي التحفيز الجنسي منه.
اللمس والتحفيز,touch_stimulation,sensation_play,touch_stimulation.sensation_play,لعبة الإحساس,يصف اللعب الحسي مجموعة واسعة من الأنشطة، سواء العادية أو المثيرة، والتي تستخدم حواس الجسم كوسيلة لإثارة وتحفيز الشريك. على الرغم من أن اللعب الحسي يرتبط غالبًا بأحاسيس الجلد، فإنه لا يجب أن يكون محدودًا إلى هذا الحد. يمكن أيضًا دمج البصر والتذوق والسمع في لعبة الإحساس.
اللمس والتحفيز,touch_stimulation,electro_stimulation,touch_stimulation.electro_stimulation,التحفيز الكهربائي,استخدام الألعاب الجنسية التي تحمل تيارًا كهربائيًا؛ مؤلم في بعض الأحيان.
اللمس والتحفيز,touch_stimulation,ice_play,touch_stimulation.ice_play,لعبة الجليد,استخدام الثلج على الجسم لتباين درجات الحرارة وتحفيز الحواس.
اللمس والتحفيز,touch_stimulation,temperature_play,touch_stimulation.temperature_play,لعبة درجة الحرارة,استخدام درجات حرارة مختلفة (ساخنة وباردة) على الجسم لتحفيز الحواس والتباين.
اللمس والتحفيز,touch_stimulation,feather_play,touch_stimulation.feather_play,لعبة الريش,استخدام الريش للحصول على لمسات خفيفة وناعمة يمكنها أن تدغدغ أو توفر إحساسًا حسيًا.
اللمس والتحفيز,touch_stimulation,pinwheel,touch_stimulation.pinwheel,طاحونة هوائية,أداة حادة تشبه العجلة (عجلة وارتنبرج) تتدحرج على الجلد، مما يسبب إحساسًا بالوخز دون تمزيق الجلد.
أوهام مختلفة,misc_fetish,fisting,misc_fetish.fisting,قبضة اليد,وضع يدك (يديك) و/أو ذراعك (ذراعيك) في المهبل، أو تلقي مثل هذه الأفعال.
أوهام مختلفة,misc_fetish,double_penetration,misc_fetish.double_penetration,اختراق مزدوج,اختراق 2 ديلدو أو قضيبين في نفس الوقت.
أوهام مختلفة,misc_fetish,gangbang,misc_fetish.gangbang,عصابة جماعية,عندما يمارس عدة شركاء، عادة 3 أو أكثر، الجنس مع شريك واحد راغب في ذلك.
أوهام مختلفة,misc_fetish,breath_play,misc_fetish.breath_play,لعبة التنفس,حالة يكون فيها لشخصية واحدة على الأقل سيطرة جسدية على عادات التنفس لشخصية أخرى، غالبًا من خلال الخنق المتقطع و/أو من خلال اختراق الحلق.
أوهام مختلفة,misc_fetish,impregnation,misc_fetish.impregnation,التسميد,تشريب شخصية.
أوهام مختلفة,misc_fetish,pregnancy,misc_fetish.pregnancy,الحمل,إضفاء طابع جنسي على شخصية حامل.
أوهام مختلفة,misc_fetish,feminization,misc_fetish.feminization,التأنيث,التأنيث هو نوع من لعب الأدوار يتم فيه فرض السمات الأنثوية التقليدية على شريك ذكر خاضع. وقد يتضمن أيضًا افتراضًا للسلوكيات والأعراف الأنثوية التقليدية.
أوهام مختلفة,misc_fetish,cuckold_cuckquean,misc_fetish.cuckold_cuckquean,الديوث / الديوث,يشير إلى فعل شخصية تم تعيينها، ضمن حدود عالم RP، لتكون في علاقة، وتمارس تفاعلًا جنسيًا مع شخصية أخرى غير تلك التي تم تعيينها لتكون في علاقة، في سياق RP.
أوهام مختلفة,misc_fetish,shaving,misc_fetish.shaving,حلاقة,إزالة شعر الجسم في سياق جنسي.
ألم,pain,light_pain,pain.light_pain,ألم خفيف,يشير إلى إضافة الألم الجسدي الخفيف من خلال الأفعال الجنسية المباشرة.
ألم,pain,heavy_pain,pain.heavy_pain,ألم شديد,يشير إلى إضافة الألم الجسدي الشديد من خلال الأفعال الجنسية المباشرة؛ عادة ما تكون الاختراقات خشنة أو مفرطة. من المحتمل أن يترك هذا علامة.
ألم,pain,nipple_clamps,pain.nipple_clamps,مشابك الحلمة,جهاز ضغط يتم تطبيقه على الحلمات لإحداث الألم الذي يعطي المتعة.
ألم,pain,clothes_pins,pain.clothes_pins,مشابك الملابس,اضغط على الجلد بين شوكة مشبك الغسيل.
ألم,pain,caning,pain.caning,العصي,الضرب بالعصا هو أسلوب يستخدم في BDSM حيث يقوم المهيمن بضرب الخاضع بشكل متكرر بعصا طويلة ومرنة، عادة على الأرداف.
ألم,pain,flogging,pain.flogging,لجلد,استخدام الألعاب، المرتبطة عادة بـ BDSM والسيطرة/الخضوع، والتي تستخدم ضد الخاضع أو المؤخر، وخاصة فيما يتعلق باللعب التلامسي باستخدام السوط من أي نوع، أو سياط الركوب، أو المجاديف، أو السوط.
ألم,pain,gagging_choking,pain.gagging_choking,الاختناق / الاختناق,التسبب في الاختناق أو التقيؤ، إما عن طريق إدخال أشياء في الفم أو اليدين/الأشياء حول الرقبة.
ألم,pain,spanking,pain.spanking,الضرب,ضرب مؤخرة شخصية أخرى، أو أن يكون الشخص متلقيًا لمثل هذه الأفعال؛ في كثير من الأحيان كشكل من أشكال المداعبة الجنسية أو كعقاب في بيئة BDSM.
ألم,pain,cock_pussy_slapping,pain.cock_pussy_slapping,ضرب القضيب/المهبل,ضرب الأعضاء التناسلية لشريكك أو تلقي مثل هذه الضربات.
ألم,pain,cock_pussy_torture,pain.cock_pussy_torture,تعذيب القضيب/المهبل,المشاركة في لعبة لعب الأدوار حيث ستتلقى الأعضاء التناسلية لشخصية واحدة على الأقل اهتمامًا سلبيًا، بقصد التسبب في ألم جسدي.
ألم,pain,hot_wax,pain.hot_wax,كان ساخنًا,استخدام الشمع، وعادة ما يكون شمع الشموع الساخن، كشكل من أشكال التحفيز الجنسي و/أو التعذيب، أو تلقي مثل هذه الأفعال.
ألم,pain,scratching,pain.scratching,للخدش,شخصية تخدش شخصية أخرى بأظافرها أو مخالبها، مما يترك علامات في بعض الأحيان؛ أحيانًا ولكن ليس بالضرورة مؤلمًا.
ألم,pain,biting,pain.biting,يعض,فعل العض أو العض؛ أحيانًا مؤلمة، وأحيانًا أخرى مرحة.
ألم,pain,cutting,pain.cutting,القطع,قطع الشريك لإحداث الألم في سياق جنسي.
ألم,pain,snuff,pain.snuff,شم,قتل شخصية كجزء من الجنس.
ألم,pain,beating,pain.beating,لضرب,الضرب بقبضات اليد أو بأشياء أخرى.
ألم,pain,face_slapping,pain.face_slapping,صفعة على الوجه,فعل ضرب شخص ما في وجهه كشكل من أشكال الإذلال أو الإثارة.
ألم,pain,punching,pain.punching,جذوع الأشجار,استخدام مصافحة القبضة كشكل من أشكال التحفيز الجنسي.
ألم,pain,clamps_labia_clit,pain.clamps_labia_clit,المشابك (الشفرين/البظر),استخدام المشابك على الشفرين أو البظر لتحفيز الألم.
ألم,pain,fire_play,pain.fire_play,لعبة النار,استخدام النار أو الحرارة للتحفيز الجنسي، والذي يتضمن في كثير من الأحيان سوائل تحرق الجلد لفترة قصيرة.
ألم,pain,knife_play,pain.knife_play,لعبة السكين,استخدام السكاكين أو الأشياء الحادة لإحداث الخوف أو الإثارة أو الألم الخفيف، وعادةً دون إحداث أي كسر للجلد.
ألم,pain,needle_play,pain.needle_play,لعبة الإبرة,استخدام الإبر التي يتم إدخالها من خلال الجلد للتحفيز الجنسي.
ألم,pain,vampire_gloves,pain.vampire_gloves,قفازات مصاصي الدماء,قفازات خاصة تحتوي على مسامير معدنية صغيرة توخز الجلد عند لمسها.
واسطة,medium,skype,medium.skype,سكايب,استخدام Skype كمنصة للعب الأدوار.
واسطة,medium,whatsapp,medium.whatsapp,واتساب,استخدام WhatsApp كمنصة للعب الأدوار.
واسطة,medium,kik,medium.kik,كيك,استخدام Kik كمنصة للعب الأدوار.
واسطة,medium,reddit,medium.reddit,ريديت,استخدام Reddit كمنصة للعب الأدوار.
واسطة,medium,email,medium.email,بريد إلكتروني,استخدام البريد الإلكتروني كمنصة للعب الأدوار.
واسطة,medium,discord,medium.discord,ديسكورد,استخدام Discord كمنصة للعب الأدوار.
واسطة,medium,other_medium,medium.other_medium,خلاف ذلك,استخدام منصة أخرى للعب الأدوار.
المقياس الزمني,time_scale,short_term_scenes,time_scale.short_term_scenes,مشاهد قصيرة المدى,مشاهد لعب الأدوار التي تستمر لفترة قصيرة من الزمن، وعادة ما تكون جلسة واحدة.
المقياس الزمني,time_scale,medium_term_scenes,time_scale.medium_term_scenes,مشاهد متوسطة المدى,مشاهد لعب الأدوار التي تستمر لفترة زمنية معتدلة، وعادة ما تكون عدة جلسات.
المقياس الزمني,time_scale,long_term_scenes,time_scale.long_term_scenes,مشاهد طويلة الأمد,مشاهد لعب الأدوار التي تستمر لفترة زمنية طويلة، وعادةً ما تكون عبارة عن جلسات عديدة أو حملة مستمرة.
المقياس الزمني,time_scale,quick_replies,time_scale.quick_replies,إجابات سريعة,الإجابات تأتي خلال 0-10 دقائق.
المقياس الزمني,time_scale,fast_replies,time_scale.fast_replies,إجابات سريعة,سيتم إرسال الإجابات خلال 10-30 دقيقة.
المقياس الزمني,time_scale,normal_replies,time_scale.normal_replies,الإجابات العادية,الإجابات تأتي خلال 30 دقيقة إلى ساعتين.
المقياس الزمني,time_scale,slow_replies,time_scale.slow_replies,الإجابات البطيئة,سيتم إرسال الإجابات خلال 2-8 ساعات.
المقياس الزمني,time_scale,glacial_replies,time_scale.glacial_replies,إجابات بطيئة جدًا,سيتم إرسال الإجابات خلال 8-24 ساعة.
المقياس الزمني,time_scale,occasional_replies,time_scale.occasional_replies,إجابات عرضية,الإجابات تأتي بعد 24 ساعة أو أكثر.
لعب الأدوار,role_play,medical_scenes,role_play.medical_scenes,مشاهد طبية,لعبة لعب الأدوار التي يتم فيها محاكاة الإجراءات الطبية والفحوصات وديناميكيات الطبيب والمريض.
لعب الأدوار,role_play,animal_roleplay,role_play.animal_roleplay,لعب دور الحيوانات,لعبة لعب الأدوار حيث يقوم الشخص بتقليد سلوكيات وتصرفات حيوان.
لعب الأدوار,role_play,age_play,role_play.age_play,لعبة العمر,لعبة لعب الأدوار حيث يتظاهر المشاركون بأنهم في عمر مختلف عن أعمارهم الحقيقية (جميعهم بالغين).
لعب الأدوار,role_play,prison_scenes,role_play.prison_scenes,مشاهد السجن,لعب الأدوار في إطار السجن، غالبًا مع ديناميكيات بين الحارس والسجين.
لعب الأدوار,role_play,schoolroom_scenes,role_play.schoolroom_scenes,مشاهد الفصل الدراسي,لعب الأدوار في بيئة مدرسية، غالبًا مع ديناميكيات المعلم والطالب.
لعب الأدوار,role_play,prostitution_fantasy,role_play.prostitution_fantasy,خيال الدعارة,لعب الأدوار حيث يتظاهر الشخص بممارسة الجنس مقابل المال أو الخدمات.
لعب الأدوار,role_play,religious_scenes,role_play.religious_scenes,مشاهد دينية,لعب الأدوار مع العناصر أو الإعدادات الدينية، مثل الاعتراف أو الخطيئة.
لعب الأدوار,role_play,interrogations,role_play.interrogations,الاستجوابات,لعب الأدوار الذي يتم فيه استجواب الشخص، والذي غالبًا ما ينطوي على ديناميكيات القوة والضغط.
لعب الأدوار,role_play,fear_play,role_play.fear_play,لعبة الخوف,الأنشطة التي تثير الخوف عمداً كجزء من التجربة الجنسية.
لعب الأدوار,role_play,egyptian,role_play.egyptian,مصري,سيناريوهات لعب الأدوار مع مواضيع مصرية قديمة، مثل الفراعنة، وكليوباترا، والآلهة والأساطير.
