Category Name,Category ID,Kink ID,Translation Key,Label,Tooltip
Corpos,bodies,skinny,bodies.skinny,Magro,"Interessado em personagens magros, finos ou esbeltos."
Corpos,bodies,chubby,bodies.chubby,Gordinho,"Interessado em personagens mais redondos, encorpados e rechonchudos."
Corpos,bodies,small_breasts,bodies.small_breasts,Seios pequenos,"Interesse por seios excepcionalmente pequenos, às vezes a ponto de parecerem quase ausentes."
Corpos,bodies,large_breasts,bodies.large_breasts,Seios grandes,Interessado em seios excepcionalmente grandes.
Corpos,bodies,small_cocks,bodies.small_cocks,Paus pequenos,Interessado em pênis menores que a média.
Corpos,bodies,large_cocks,bodies.large_cocks,Paus grandes,Interessado em paus maiores que a média.
Corpos,bodies,small_butts,bodies.small_butts,Nádegas pequenas,Interessado em nádegas particularmente pequenas.
Corpos,bodies,big_butts,bodies.big_butts,Nádegas grandes,Interessado em nádegas particularmente grandes.
Roupas,clothing,clothed_sex,clothing.clothed_sex,Sexo com roupa,Participar de uma RP em que você e/ou seu parceiro não estejam despidos durante a interação sexual.
Roupas,clothing,lingerie,clothing.lingerie,Lingerie,"Interesse no uso de lingerie no contexto sexual de um RP, ou interesse em personagens que a usam."
Roupas,clothing,stockings,clothing.stockings,Meias,"Interesse no uso de meias no contexto sexual de um RP, ou interesse em personagens que as usam."
Roupas,clothing,heels,clothing.heels,Salto,"Interesse no uso de saltos altos no contexto sexual de um RP, ou interesse em personagens que os usam."
Roupas,clothing,leather,clothing.leather,Aprender,"Interessado no uso de roupas de couro no contexto sexual de um RP, ou interessado em personagens que as usam."
Roupas,clothing,latex,clothing.latex,Látex,O uso de material de látex e/ou borracha usado como roupa.
Roupas,clothing,uniform_costume,clothing.uniform_costume,Uniforme / traje,"Interesse no uso de uniformes ou fantasias no contexto sexual de um RP, ou interesse em personagens que os usam."
Roupas,clothing,cross_dressing,clothing.cross_dressing,Travesti,Participar de um RP onde um ou mais personagens se vestem com roupas do sexo oposto.
Em geral,general,handjob_fingering,general.handjob_fingering,Masturbação / Dedilhado,Estimulação sexual através do contato físico direto das mãos ou dedos com os genitais.
Em geral,general,oral,general.oral,Oral,Estimulação sexual por meio de contato físico direto da boca ou da língua com os genitais.
Em geral,general,deep_throat,general.deep_throat,Garganta Profunda,"Penetrar a boca de outro personagem até a profundidade em que o pênis ou objeto inserido entra na parte posterior da cavidade oral e/ou garganta, às vezes causando reflexo de vômito, ou receber tais atos."
Em geral,general,swallowing,general.swallowing,Engolir,"O consumo oral de sêmen ou esguicho, direto ou indireto, de um órgão genital."
Em geral,general,facials,general.facials,Tratamentos faciais,O ato de ejacular/esguichar diretamente no rosto de alguém.
Em geral,general,face_sitting,general.face_sitting,Sentada na cara,"Prática sexual na qual alguém se senta com as nádegas ou genitais no rosto de outro personagem, sufocando a pessoa, às vezes até o ponto de asfixia; muitas vezes feito como uma forma de coagir a gratificação oral."
Em geral,general,edging,general.edging,Afiação,Ficar à beira do clímax sem ter um orgasmo.
Em geral,general,teasing,general.teasing,Pragas,"Refere-se a cenas prolongadas de preliminares antes de uma relação sexual explícita, que podem ser físicas e/ou verbais, geralmente para excitar o parceiro a ponto de causar frustração ou desespero sexual."
Em geral,general,ruined,general.ruined,Arruinado,"O ato de permitir que uma pessoa tenha um orgasmo, mas interromper a estimulação pouco antes do clímax, resultando em um orgasmo incompleto ou insatisfatório. Isso pode ocorrer tanto com parceiros homens quanto mulheres."
Jogo Anal,ass_play,anal_toys,ass_play.anal_toys,Brinquedos anais,"Refere-se à penetração anal com brinquedos sexuais, incluindo, mas não se limitando a, consolos, vibradores, ovos anais, contas anais, etc."
Jogo Anal,ass_play,anal_sex_pegging,ass_play.anal_sex_pegging,Sexo anal/pegging,"Ser penetrado por um parceiro, com um pênis ou uma cinta."
Jogo Anal,ass_play,rimming,ass_play.rimming,Arrebentamento,Fornecer estimulação oral ao ânus do parceiro lambendo e/ou penetrando o ânus do receptor com a língua.
Jogo Anal,ass_play,double_penetration,ass_play.double_penetration,Dupla penetração,"Penetrar ou receber o ânus de um único personagem com dois objetos, incluindo, mas não se limitando a, pênis, brinquedos sexuais, punho, etc."
Jogo Anal,ass_play,anal_fisting,ass_play.anal_fisting,Fisting anal,Inserir a(s) mão(s) e/ou braço(s) no ânus do parceiro ou receber tais atos.
Restritivo,restrictive,collar,restrictive.collar,Colarinho,Usar uma coleira em volta do pescoço.
Restritivo,restrictive,leash,restrictive.leash,Cinto,Ser levado por uma coleira.
Restritivo,restrictive,chastity,restrictive.chastity,Castidade,"Abstinência sexual, voluntária ou forçada; Isso pode envolver alguém simplesmente se abstendo de atividade sexual ou usando um dispositivo que a impeça."
Restritivo,restrictive,bondage_light,restrictive.bondage_light,Bondage (Luz),"O uso de escravidão que seja leve ou moderada, seja na posição em que coloca o personagem amarrado, no período em que o personagem ficará em escravidão, no nível de desconforto causado pela escravidão ou no grau de imobilização que ocorrerá como resultado da escravidão."
Restritivo,restrictive,bondage_heavy,restrictive.bondage_heavy,Bondage (Pesado),"O uso de escravidão que é extremo, seja na posição em que coloca o personagem amarrado, no período em que o personagem ficará em escravidão, no nível de desconforto causado pela escravidão ou no grau de imobilização que ocorrerá como resultado da escravidão."
Restritivo,restrictive,encasement,restrictive.encasement,Confinamento,"O corpo inteiro é envolto como uma múmia em um traje de látex, saco de dormir ou outro equipamento fetichista para satisfação sexual."
Restritivo,restrictive,cag,restrictive.cag,Castidade/gaiolas,Um dispositivo que impede o acesso aos órgãos genitais.
Restritivo,restrictive,blindfold,restrictive.blindfold,Venda nos olhos,"Cobrir os olhos para obstruir a visão, o que pode aguçar outros sentidos e aumentar sentimentos de vulnerabilidade."
Restritivo,restrictive,breast_bondage,restrictive.breast_bondage,Bondage de seios,"Técnicas específicas de bondage que envolvem amarrar os seios, o que pode aumentar a sensibilidade e ser visualmente estimulante."
Restritivo,restrictive,rope_simple,restrictive.rope_simple,Bondage de corda (simples),Técnicas básicas de amarração com corda para restringir membros ou movimentos.
Restritivo,restrictive,rope_shibari,restrictive.rope_shibari,Amarração com corda (Shibari),Arte japonesa complexa e estética de encadernação de corda que combina limitações funcionais e expressão artística.
Restritivo,restrictive,spreader_bars,restrictive.spreader_bars,Barras espalhadoras,"Barras usadas para manter os membros separados, facilitando o acesso e aumentando a vulnerabilidade."
Restritivo,restrictive,suspension,restrictive.suspension,Suspensão,"Técnicas de bondage em que o corpo é parcial ou completamente levantado do chão, criando uma sensação única de leveza e entrega completa."
Restritivo,restrictive,mummification,restrictive.mummification,Mumificação,"Envolver completamente o corpo em materiais como filme plástico, fita ou látex, resultando em imobilização quase completa."
Restritivo,restrictive,sensory_deprivation,restrictive.sensory_deprivation,Privação sensorial,"Limitar ou eliminar informações sensoriais, como visão, audição ou tato, para aprimorar outros sentidos e aprofundar o foco."
Restritivo,restrictive,armbinders,restrictive.armbinders,Braçadeiras,"Tubos especiais que fixam os braços atrás das costas, causando imobilização completa dos braços."
Restritivo,restrictive,cages,restrictive.cages,Gaiolas,Estar trancado em uma gaiola ou cela como uma forma de escravidão e dinâmica de poder.
Restritivo,restrictive,chains,restrictive.chains,Correntes,"Estar amarrado com correntes, o que dá uma sensação única de peso e frio em comparação com outros materiais de bondage."
Restritivo,restrictive,leather_cuffs,restrictive.leather_cuffs,Algemas de couro,Algemas de couro para prender pulsos ou tornozelos.
Restritivo,restrictive,metal_cuffs,restrictive.metal_cuffs,Algemas de metal,Algemas de metal tradicionais usadas para prender pulsos ou tornozelos.
Restritivo,restrictive,gag_ball,restrictive.gag_ball,Balgag,Uma mordaça em forma de bola que é colocada na boca e presa atrás da cabeça.
Restritivo,restrictive,gag_ring,restrictive.gag_ring,Mordaça de anel,"Uma mordaça em forma de anel que mantém a boca aberta, permitindo o acesso à boca e impedindo a fala."
Restritivo,restrictive,gag_tape,restrictive.gag_tape,Mordaça de fita,Fita usada para cobrir a boca e impedir a fala.
Restritivo,restrictive,hoods,restrictive.hoods,Capuzes,"Cobertura total da cabeça que pode criar uma sensação de anonimato, despersonalização ou privação sensorial."
Restritivo,restrictive,immobilisation,restrictive.immobilisation,Imobilização,Restrição completa de movimento por meio de diversas técnicas de bondage.
Restritivo,restrictive,leather_restraints,restrictive.leather_restraints,Punhos de couro,"Várias algemas feitas de couro, usadas para diferentes formas de bondage."
Restritivo,restrictive,stocks,restrictive.stocks,pelourinho,Dispositivo de restrição medieval tradicional que segura a cabeça e as mãos.
Restritivo,restrictive,straight_jacket,restrictive.straight_jacket,Camisa de força,"Uma vestimenta especial projetada para imobilizar os braços, prendendo-os ao corpo."
Restritivo,restrictive,sleep_sack,restrictive.sleep_sack,Saco de dormir,"Um saco especial e apertado no qual todo o corpo é fechado, semelhante à mumificação."
Brinquedos,toys,dildos,toys.dildos,Dildos,Um objeto em forma de pênis ereto usado para estimulação sexual.
Brinquedos,toys,plugs,toys.plugs,Plugues,Um brinquedo sexual projetado para ser inserido no reto.
Brinquedos,toys,vibrators,toys.vibrators,Vibradores,Um dispositivo vibratório usado para estimulação sexual.
Brinquedos,toys,sounding,toys.sounding,Soando,"A inserção de hastes de metal na uretra de um homem ou mulher, ou a realização de tais atos; tecnicamente implica hastes que ressoam e/ou vibram em resposta a alguma forma de estimulação, mas não necessariamente significa isso."
Domínio,domination,dd_lg_md_lb,domination.dd_lg_md_lb,"DD/lg, MD/lb","Papai ou mamãe Dom/Menina ou Menino. O papai/mamãe é a metade mais dominante do relacionamento, o pequeno é o mais submisso."
Domínio,domination,domestic_servitude,domination.domestic_servitude,Serviço doméstico,"Ser servido por um mordomo, garçonete, motorista, empregada doméstica ou governanta, ou servir em tal função."
Domínio,domination,slavery,domination.slavery,Escravidão,"Servir como escravo às ordens do dominante, ou receber tal serviço, sem escolha."
Domínio,domination,pet_play,domination.pet_play,Jogo de bichinhos de estimação,"Brincar com animais de estimação é um papel em que o foco está no submisso assumindo um estado mental alternativo, geralmente o de um cachorro, gato ou cavalo."
Domínio,domination,begging,domination.begging,Implorar,"O ato autodegradante de implorar, como uma forma de submissão, que é incorporado a um RP."
Domínio,domination,discipline,domination.discipline,Disciplina,O uso de reforço (recompensas e/ou punições) para treinar um submisso a obedecer aos vários comandos de um mestre.
Domínio,domination,forced_orgasm,domination.forced_orgasm,Orgasmo forçado,Um orgasmo forçado é uma prática BDSM consensual ou uma brincadeira sexual excêntrica na qual uma pessoa consente em ser forçada a ter um orgasmo de uma maneira que está além do seu controle.
Domínio,domination,orgasm_denial,domination.orgasm_denial,Abstinência de orgasmo,Refere-se ao dominante negando ao submisso um orgasmo.
Domínio,domination,multiple_orgasms,domination.multiple_orgasms,Orgasmos múltiplos,"Forçar ou experimentar orgasmos múltiplos em sucessão, às vezes até o ponto de superestimulação ou exaustão."
Domínio,domination,orgasm_training,domination.orgasm_training,Treinamento de orgasmo,"Treinar um submisso para gozar quando ordenado, ou gozar somente com a permissão do dominante."
Sem Consentimento,no_consent,dubious_consent,no_consent.dubious_consent,Consentimento questionável,"Situações em que o consentimento do parceiro é questionado, embora não seja considerado estupro."
Sem Consentimento,no_consent,non_con_rape,no_consent.non_con_rape,Não-con/estupro,"Tomar/ser tomado contra a vontade, geralmente à força."
Sem Consentimento,no_consent,blackmail_coercion,no_consent.blackmail_coercion,Chantagem / coerção,"Refere-se ao uso de coerção e/ou chantagem no contexto da história de um RP, geralmente na forma de um meio semiconsensual para obter sexo de um parceiro."
Sem Consentimento,no_consent,kidnapping,no_consent.kidnapping,Sequestro,"Sequestrar um personagem em um RPG com a finalidade de abuso, geralmente sexual, ou ser sequestrado por tais motivos; muitas vezes implica prisão por tempo indeterminado."
Sem Consentimento,no_consent,drugs,no_consent.drugs,Drogas,"O uso de drogas ilegais no contexto de um RP, geralmente para desorientar ou incapacitar mentalmente um personagem, ou para aumentar as sensações sexuais."
Sem Consentimento,no_consent,alcohol,no_consent.alcohol,Álcool,"O uso de álcool no contexto de um RP, geralmente para desorientar ou incapacitar mentalmente um personagem, ou para intensificar as sensações sexuais."
Sem Consentimento,no_consent,sleep_play,no_consent.sleep_play,Jogo do sono,Envolver-se em atos sexuais com um parceiro inconsciente/adormecido.
Tabu,taboo,incest,taboo.incest,Incesto,Participe de um RP onde pelo menos dois personagens sejam relacionados.
Tabu,taboo,age_gap,taboo.age_gap,Diferença de idade,Refere-se a cenas onde há uma diferença significativa nas idades dos personagens.
Tabu,taboo,interracial,taboo.interracial,Interracial,Cenas baseadas em interações interraciais sem depender de estereótipos raciais.
Tabu,taboo,raceplay,taboo.raceplay,Jogo de corrida,"Cenas baseadas em estereótipos raciais ou racismo, incluindo cenas ambientadas em cenários racistas."
Tabu,taboo,bestiality,taboo.bestiality,Bestialidade,"Refere-se a um personagem senciente realizando um ato sexual em um animal não senciente, ou interpretando um animal não senciente em um RPG e sendo abordado por um personagem senciente."
Tabu,taboo,necrophilia,taboo.necrophilia,Necrofilia,"O ato de fazer sexo com um personagem morto, ou inconsciente ou inanimado, que já esteve vivo, ou, teoricamente, receber tais atos."
Tabu,taboo,cheating,taboo.cheating,Trapaceando,Quando um ou ambos os parceiros são infiéis aos seus parceiros.
Tabu,taboo,exhibitionism,taboo.exhibitionism,Exibicionismo,Participar de uma RP cujo cenário seja de natureza pública; geralmente usado em combinação com exibicionismo e/ou humilhação.
Tabu,taboo,voyeurism,taboo.voyeurism,Voyeurismo,"Refere-se à obtenção de estimulação sexual pelo ato de observar, geralmente secretamente, uma pessoa (ou pessoas) se revelando ou fazendo algo explícito, ou pelo ato de se revelar e/ou fazer algo explícito com a intenção de ser observado."
Surrealismo,surrealism,futanari_futa,surrealism.futanari_futa,Futanari/Futa,"Personagens que têm um corpo geralmente feminino, mas têm genitais femininos e masculinos (embora os testículos nem sempre estejam presentes)."
Surrealismo,surrealism,furry,surrealism.furry,Peludo,Personagens animais antropomórficos.
Surrealismo,surrealism,vore,surrealism.vore,Sulco,O ato de consumir fisicamente outro personagem.
Surrealismo,surrealism,transformation,surrealism.transformation,Transformação,"O ato de fazer com que as características físicas de um participante de uma RP, possivelmente incluindo a si mesmo, mudem de maneira dramática por meio de meios mágicos ou químicos; pode se referir a vários tipos diferentes de transformações e indica receber prazer sexual do próprio ato de transformação."
Surrealismo,surrealism,tentacles,surrealism.tentacles,Tentáculos,Participar de um RP em que tentáculos autoconscientes ou apêndices semelhantes a tentáculos penetrarão um personagem; muitas vezes envolve múltiplas penetrações.
Surrealismo,surrealism,monster_or_alien,surrealism.monster_or_alien,Monstro ou Alienígena,"Diferentes tipos de monstros, alienígenas e personagens esteticamente desafiadores."
Surrealismo,surrealism,ghost,surrealism.ghost,Espírito,"Anteriormente vivo, mas atualmente sem posse de um corpo."
Líquidos,fluids,blood,fluids.blood,Sangue,"Relativo à coleta ou obtenção de sangue em qualquer forma em um contexto sexual, ou à realização de atos que extraiam sangue."
Líquidos,fluids,watersports,fluids.watersports,Esportes aquáticos,"Refere-se ao ato de inalar urina ou expelir urina, em qualquer forma, no contexto sexual de uma RP."
Líquidos,fluids,scat,fluids.scat,Excremento,Refere-se à ingestão de fezes ou à expulsão de fezes de qualquer forma no contexto sexual de uma RP.
Líquidos,fluids,lactation,fluids.lactation,Lactação,"Produzir leite dos próprios seios ou fazer sexo com um personagem que produz leite dos próprios seios, geralmente em resposta à estimulação sexual e qualquer brincadeira resultante disso."
Líquidos,fluids,diapers,fluids.diapers,Fraldas,"Uma situação em que pelo menos um personagem estará usando fralda; geralmente implica que a fralda estará suja com urina e/ou fezes, geralmente em combinação com brincadeiras de velhice ou infantilismo, mas às vezes em combinação com humilhação."
Líquidos,fluids,cum_play,fluids.cum_play,Jogo do esperma,Várias situações envolvendo gozada.
Líquidos,fluids,saliva_spit,fluids.saliva_spit,Saliva/cuspe,Brincadeira sexual com saliva ou cuspe.
Líquidos,fluids,creampie,fluids.creampie,Creme,Ejacular em um parceiro e permitir que o sêmen vaze ou flua para fora.
Líquidos,fluids,cum_on_body,fluids.cum_on_body,Gozada no corpo,Ejacular no corpo do parceiro como forma de brincadeira sexual.
Líquidos,fluids,cum_on_face,fluids.cum_on_face,Gozada na cara,"O ato de ejacular no rosto do parceiro, às vezes como uma forma de dominação ou humilhação."
Humilhação,degradation,glory_hole,degradation.glory_hole,Buraco da glória,Servir ou ser servido por um parceiro com uma barreira física entre os participantes.
Humilhação,degradation,name_calling,degradation.name_calling,Xingamento,"Envolver-se em um RPG em que um personagem será abusado verbalmente, na tentativa de obter uma resposta de gratificação sexual a partir das emoções correlacionadas à humilhação, ou meramente como uma forma de dominação psicológica ou punição."
Humilhação,degradation,humiliation,degradation.humiliation,Humilhação,"Envolver-se em um RPG no qual um personagem ficará envergonhado, geralmente de forma extrema e/ou frequente, na tentativa de obter uma resposta de gratificação sexual a partir das emoções que se correlacionam com a humilhação, ou meramente como uma forma de dominação psicológica ou punição; geralmente uma forma mais intensa de degradação."
Toque e estimulação,touch_stimulation,cock_pussy_worship,touch_stimulation.cock_pussy_worship,Adoração ao Pênis/Vagina,"Reconhecimento excessivo dos órgãos genitais do seu parceiro, seja verbalmente e/ou fisicamente, ou receber tais atos; geralmente envolve estimulação oral."
Toque e estimulação,touch_stimulation,ass_worship,touch_stimulation.ass_worship,Adoração de bunda,"Reconhecimento excessivo das nádegas da parceira, seja verbalmente e/ou fisicamente, ou receber tais atos; geralmente envolve estimulação oral."
Toque e estimulação,touch_stimulation,foot_play,touch_stimulation.foot_play,Jogo de pé,"O uso dos pés no contexto sexual de uma RP, incluindo, mas não se limitando a adoração dos pés, receber gratificação sexual pela visão ou cheiro dos pés e/ou transar com os pés, às vezes até o ponto do orgasmo."
Toque e estimulação,touch_stimulation,tickling,touch_stimulation.tickling,Cócegas,O ato de fazer cócegas e/ou ser feito cócegas em um contexto sexual de um RP; ou receber estimulação sexual dele.
Toque e estimulação,touch_stimulation,sensation_play,touch_stimulation.sensation_play,Jogo de sensações,"Brincadeiras sensuais descrevem uma ampla gama de atividades, tanto as mais vulgares quanto as mais excêntricas, que usam os sentidos do corpo como uma forma de excitar e estimular o parceiro. Embora o jogo sensorial esteja frequentemente relacionado às sensações da pele, ele não precisa ser tão limitado. Visão, paladar e audição também podem ser incorporados à brincadeira sensorial."
Toque e estimulação,touch_stimulation,electro_stimulation,touch_stimulation.electro_stimulation,Eletroestimulação,O uso de brinquedos sexuais que transportam corrente elétrica; às vezes doloroso.
Toque e estimulação,touch_stimulation,ice_play,touch_stimulation.ice_play,Jogo de gelo,O uso de gelo no corpo para contrastes de temperatura e estimulação sensorial.
Toque e estimulação,touch_stimulation,temperature_play,touch_stimulation.temperature_play,Jogo de temperatura,O uso de diferentes temperaturas (quente e fria) no corpo para estimulação sensorial e contraste.
Toque e estimulação,touch_stimulation,feather_play,touch_stimulation.feather_play,Jogo de penas,O uso de penas para toques leves e suaves que podem provocar cócegas ou proporcionar uma sensação sensual.
Toque e estimulação,touch_stimulation,pinwheel,touch_stimulation.pinwheel,Cata-vento,"Um instrumento afiado, semelhante a uma roda (roda de Wartenberg), que rola sobre a pele, causando uma sensação de ardência sem romper a pele."
Vários Fetiches,misc_fetish,fisting,misc_fetish.fisting,Fisting,Colocar a(s) mão(s) e/ou braço(s) na vagina ou receber tais atos.
Vários Fetiches,misc_fetish,double_penetration,misc_fetish.double_penetration,Dupla penetração,Penetração de 2 dildos ou pênis ao mesmo tempo.
Vários Fetiches,misc_fetish,gangbang,misc_fetish.gangbang,Sexo em grupo,"Quando vários parceiros, geralmente três ou mais, têm relações sexuais com um único parceiro disposto."
Vários Fetiches,misc_fetish,breath_play,misc_fetish.breath_play,Jogo de respiração,"Uma situação em que pelo menos um personagem terá controle físico sobre os hábitos respiratórios de outro personagem, geralmente por meio de estrangulamento intermitente e/ou penetração na garganta."
Vários Fetiches,misc_fetish,impregnation,misc_fetish.impregnation,Fertilização,Impregnando um personagem.
Vários Fetiches,misc_fetish,pregnancy,misc_fetish.pregnancy,Gravidez,Fetichizando uma personagem grávida.
Vários Fetiches,misc_fetish,feminization,misc_fetish.feminization,Feminização,Feminização é um tipo de representação de papéis em que características tradicionalmente femininas são impostas a um parceiro masculino submisso. Também pode envolver uma assunção de comportamento e maneiras femininas tradicionais.
Vários Fetiches,misc_fetish,cuckold_cuckquean,misc_fetish.cuckold_cuckquean,Corno / Cuckquean,"Refere-se ao ato de um personagem que, dentro dos limites do mundo do RP, é designado para estar em um relacionamento, tendo interação sexual com um personagem diferente daquele que é designado para estar em um relacionamento, no contexto do RP."
Vários Fetiches,misc_fetish,shaving,misc_fetish.shaving,Depilar,A remoção de pelos do corpo em um contexto sexual.
Dor,pain,light_pain,pain.light_pain,Dor leve,Refere-se à adição de dor física leve por meio de atos diretamente sexuais.
Dor,pain,heavy_pain,pain.heavy_pain,Dor severa,Refere-se à adição de dor física severa por meio de atos que são diretamente sexuais; geralmente penetrações ásperas ou excessivas. Isso provavelmente deixará uma marca.
Dor,pain,nipple_clamps,pain.nipple_clamps,Grampos de mamilo,Dispositivo de pressão aplicado nos mamilos para causar dor que dá prazer.
Dor,pain,clothes_pins,pain.clothes_pins,Prendedores de roupa,Aperte a pele entre os garfos de um prendedor de roupa.
Dor,pain,caning,pain.caning,Paus,"Caning é uma técnica usada em BDSM na qual o dominante bate repetidamente no submisso com uma bengala longa e flexível, geralmente nas nádegas."
Dor,pain,flogging,pain.flogging,Para flagelar,"O uso de brinquedos, geralmente associados ao BDSM e dominância/submissão, usados contra um submisso ou passivo, especialmente se referindo a brincadeiras de contato com chicotes de qualquer tipo, chicotes, remos ou chicotes."
Dor,pain,gagging_choking,pain.gagging_choking,Engasgo / Sufocamento,"Ser provocado por engasgos ou sufocamento, seja por objetos inseridos na boca ou pelas mãos/objetos ao redor do pescoço."
Dor,pain,spanking,pain.spanking,palmada,Bater nas nádegas de outro personagem ou ser alvo de tais ações; muitas vezes como uma forma de preliminares eróticas ou como punição em um ambiente BDSM.
Dor,pain,cock_pussy_slapping,pain.cock_pussy_slapping,Palmada no pau/vagina,Bater nos órgãos genitais do seu parceiro ou receber tais golpes.
Dor,pain,cock_pussy_torture,pain.cock_pussy_torture,Tortura de pau/vagina,"Participar de um RPG em que os órgãos genitais de pelo menos um personagem receberão atenção negativa, com a intenção de causar dor física."
Dor,pain,hot_wax,pain.hot_wax,Quente era,"O uso de cera, geralmente cera de vela quente, como forma de estimulação sexual e/ou tortura, ou a prática de tais atos."
