Category Name,Category ID,Kink ID,Translation Key,Label,Tooltip
Dor,pain,scratching,pain.scratching,Coçar,"Um personagem arranhando outro com suas unhas ou garras, às vezes deixando marcas; às vezes, mas não necessariamente doloroso."
Dor,pain,biting,pain.biting,Morder,"O ato de morder ou ser mordido; às vezes doloroso, às vezes brincalhão."
Dor,pain,cutting,pain.cutting,Corte,Cortar um parceiro para causar dor em um contexto sexual.
Dor,pain,snuff,pain.snuff,Rapé,Matar um personagem como parte do sexo.
Dor,pain,beating,pain.beating,Para bater,Ser atingido com punhos ou outros objetos.
Dor,pain,face_slapping,pain.face_slapping,Tapa na cara,O ato de bater no rosto de alguém como forma de humilhação ou excitação.
Dor,pain,punching,pain.punching,Tocos,O uso de toques de punho como forma de estimulação sexual.
Dor,pain,clamps_labia_clit,pain.clamps_labia_clit,Grampos (lábios/clitóris),O uso de grampos nos lábios ou clitóris para estimulação da dor.
Dor,pain,fire_play,pain.fire_play,Jogo de fogo,"O uso de fogo ou calor para estimulação sexual, geralmente envolvendo fluidos que queimam a pele por um curto período de tempo."
Dor,pain,knife_play,pain.knife_play,Jogo de facas,"O uso de facas ou objetos afiados para causar medo, excitação ou dor leve, geralmente sem realmente romper a pele."
Dor,pain,needle_play,pain.needle_play,Jogo da agulha,O uso de agulhas inseridas através da pele para estimulação sexual.
Dor,pain,vampire_gloves,pain.vampire_gloves,Luvas de vampiro,Luvas especiais com pequenas pontas de metal que furam a pele quando tocadas.
Médio,medium,skype,medium.skype,Skype,Usando o Skype como plataforma para dramatização.
Médio,medium,whatsapp,medium.whatsapp,O que você acha do WhatsApp?,Usando o WhatsApp como plataforma para dramatização.
Médio,medium,kik,medium.kik,Kik,Usando o Kik como plataforma para dramatização.
Médio,medium,reddit,medium.reddit,Reddit,Usando o Reddit como uma plataforma para RPG.
Médio,medium,email,medium.email,E-mail,Usando o e-mail como plataforma para dramatização.
Médio,medium,discord,medium.discord,Discórdia,Usando o Discord como plataforma para RPG.
Médio,medium,other_medium,medium.other_medium,De outra forma,Usando outra plataforma para interpretação de papéis.
Escala de tempo,time_scale,short_term_scenes,time_scale.short_term_scenes,Cenas de Curto Prazo,"Cenas de dramatização que duram um curto período de tempo, geralmente uma única sessão."
Escala de tempo,time_scale,medium_term_scenes,time_scale.medium_term_scenes,Cenas de médio prazo,"Cenas de dramatização que duram um período moderado de tempo, geralmente algumas sessões."
Escala de tempo,time_scale,long_term_scenes,time_scale.long_term_scenes,Cenas de Longo Prazo,"Cenas de RPG que duram um longo período de tempo, geralmente muitas sessões ou uma campanha contínua."
Escala de tempo,time_scale,quick_replies,time_scale.quick_replies,Respostas rápidas,Respostas que chegam dentro de 0 a 10 minutos.
Escala de tempo,time_scale,fast_replies,time_scale.fast_replies,Respostas rápidas,Respostas chegando em 10 a 30 minutos.
Escala de tempo,time_scale,normal_replies,time_scale.normal_replies,Respostas normais,Respostas que chegam dentro de 30 minutos a 2 horas.
Escala de tempo,time_scale,slow_replies,time_scale.slow_replies,Respostas lentas,Respostas chegando dentro de 2 a 8 horas.
Escala de tempo,time_scale,glacial_replies,time_scale.glacial_replies,Respostas muito lentas,Respostas chegando dentro de 8 a 24 horas.
Escala de tempo,time_scale,occasional_replies,time_scale.occasional_replies,Respostas Incidentais,Respostas que chegam depois de mais de 24 horas.
Jogo de papéis,role_play,medical_scenes,role_play.medical_scenes,Cenas médicas,"Jogo de RPG em que são simulados procedimentos médicos, exames e dinâmicas médico-paciente."
Jogo de papéis,role_play,animal_roleplay,role_play.animal_roleplay,Jogo de interpretação de animais,Jogo de interpretação de papéis em que uma pessoa imita o comportamento e os maneirismos de um animal.
Jogo de papéis,role_play,age_play,role_play.age_play,Jogo da idade,Jogo de interpretação de papéis em que os participantes fingem ter uma idade diferente da sua idade real (todos adultos).
Jogo de papéis,role_play,prison_scenes,role_play.prison_scenes,Cenas de prisão,"Dramatização em um ambiente prisional, geralmente com dinâmicas entre guarda e prisioneiro."
Jogo de papéis,role_play,schoolroom_scenes,role_play.schoolroom_scenes,Cenas de sala de aula,"Dramatização em ambiente escolar, geralmente com dinâmica professor-aluno."
Jogo de papéis,role_play,prostitution_fantasy,role_play.prostitution_fantasy,Fantasia de prostituição,Interpretação de papéis em que uma pessoa finge fazer sexo em troca de dinheiro ou favores.
Jogo de papéis,role_play,religious_scenes,role_play.religious_scenes,Cenas religiosas,"Interpretação de papéis com elementos ou cenários religiosos, como confissão ou pecado."
Jogo de papéis,role_play,interrogations,role_play.interrogations,Interrogatórios,"Interpretação de papéis em que uma pessoa é interrogada, geralmente envolvendo dinâmicas de poder e pressão."
Jogo de papéis,role_play,fear_play,role_play.fear_play,Jogo do medo,Atividades que induzem deliberadamente o medo como parte da experiência sexual.
Jogo de papéis,role_play,egyptian,role_play.egyptian,egípcio,"Cenários de RPG com temas do antigo Egito, como faraós, Cleópatra, deuses e mitologia."
