Category Name,Category ID,Kink ID,Translation Key,Label,Tooltip
Douleur,pain,nipple_clamps,pain.nipple_clamps,Pinces à tétons,Dispositif de pression appliqué sur les mamelons pour provoquer une douleur qui procure du plaisir.
Douleur,pain,clothes_pins,pain.clothes_pins,Pinces à linge,Pincez la peau entre les fourches d’une pince à linge.
Douleur,pain,caning,pain.caning,bâtons,"La canne est une technique utilisée dans le BDSM dans laquelle le dominant frappe à plusieurs reprises le soumis avec une longue canne flexible, généralement sur les fesses."
Douleur,pain,flogging,pain.flogging,Flétrir,"L'utilisation de jouets, généralement associés au BDSM et à la domination/soumission, utilisés contre un soumis ou un soumis, faisant notamment référence au jeu de contact avec des fouets de tout type, des cravaches, des pagaies ou des fouets."
Douleur,pain,gagging_choking,pain.gagging_choking,Bâillonnement / Étouffement,"Être amené à avoir des haut-le-cœur ou à s'étouffer, soit par des objets insérés dans la bouche, soit par des mains/objets autour du cou."
Douleur,pain,spanking,pain.spanking,fessée,Frapper les fesses d’un autre personnage ou être la cible de telles actions ; souvent comme une forme de préliminaires érotiques ou comme punition dans un cadre BDSM.
Douleur,pain,cock_pussy_slapping,pain.cock_pussy_slapping,Fessée du pénis/du vagin,Frapper les parties génitales de votre partenaire ou recevoir de tels coups.
Douleur,pain,cock_pussy_torture,pain.cock_pussy_torture,Torture du pénis/du vagin,"Participer à un RP dans lequel les parties génitales d'au moins un personnage recevront une attention négative, avec l'intention de provoquer une douleur physique."
Douleur,pain,hot_wax,pain.hot_wax,Il faisait chaud,"L'utilisation de cire, généralement de cire de bougie chaude, comme forme de stimulation sexuelle et/ou de torture, ou la réception de tels actes."
Douleur,pain,scratching,pain.scratching,Gratter,"Un personnage en griffe un autre avec ses ongles ou ses griffes, laissant parfois des marques ; parfois mais pas nécessairement douloureux."
Douleur,pain,biting,pain.biting,Mordre,"L'acte de mordre ou d'être mordu ; parfois douloureux, parfois ludique."
Douleur,pain,cutting,pain.cutting,Coupe,Couper un partenaire pour provoquer de la douleur dans un contexte sexuel.
Douleur,pain,snuff,pain.snuff,Tabac à priser,Tuer un personnage dans le cadre d'une relation sexuelle.
Douleur,pain,beating,pain.beating,Frapper,Être frappé avec des poings ou d’autres objets.
Douleur,pain,face_slapping,pain.face_slapping,Gifles au visage,L'acte de frapper quelqu'un au visage comme forme d'humiliation ou d'excitation.
Douleur,pain,punching,pain.punching,souches,L'utilisation de coups de poing comme forme de stimulation sexuelle.
Douleur,pain,clamps_labia_clit,pain.clamps_labia_clit,Pinces (lèvres/clitoris),L'utilisation de pinces sur les lèvres ou le clitoris pour stimuler la douleur.
Douleur,pain,fire_play,pain.fire_play,Jeu de feu,"L’utilisation du feu ou de la chaleur pour la stimulation sexuelle, impliquant souvent des fluides qui brûlent la peau pendant une courte période."
Douleur,pain,knife_play,pain.knife_play,Jeu de couteau,"L’utilisation de couteaux ou d’objets tranchants pour provoquer la peur, l’excitation ou une légère douleur, généralement sans réellement percer la peau."
Douleur,pain,needle_play,pain.needle_play,Jeu d'aiguilles,L’utilisation d’aiguilles insérées à travers la peau pour la stimulation sexuelle.
Douleur,pain,vampire_gloves,pain.vampire_gloves,Gants de vampire,Gants spéciaux avec de petites pointes métalliques qui piquent la peau au toucher.
Moyen,medium,skype,medium.skype,Skype,Utiliser Skype comme plateforme de jeu de rôle.
Moyen,medium,whatsapp,medium.whatsapp,WhatsApp,Utiliser WhatsApp comme plateforme de jeu de rôle.
Moyen,medium,kik,medium.kik,Kik,Utiliser Kik comme plateforme de jeu de rôle.
Moyen,medium,reddit,medium.reddit,Reddit,Utiliser Reddit comme plateforme de jeu de rôle.
Moyen,medium,email,medium.email,E-mail,Utiliser le courrier électronique comme plateforme de jeu de rôle.
Moyen,medium,discord,medium.discord,Discorde,Utiliser Discord comme plateforme de jeu de rôle.
Moyen,medium,other_medium,medium.other_medium,Sinon,Utiliser une autre plateforme pour le jeu de rôle.
Échelle de temps,time_scale,short_term_scenes,time_scale.short_term_scenes,Scènes à court terme,"Scènes de jeu de rôle qui durent une courte période, généralement une seule session."
Échelle de temps,time_scale,medium_term_scenes,time_scale.medium_term_scenes,Scènes à moyen terme,"Scènes de jeu de rôle qui durent une période de temps modérée, généralement quelques séances."
Échelle de temps,time_scale,long_term_scenes,time_scale.long_term_scenes,Scènes à long terme,"Scènes de jeu de rôle qui durent sur une période prolongée, généralement plusieurs sessions ou une campagne en cours."
Échelle de temps,time_scale,quick_replies,time_scale.quick_replies,Réponses rapides,Des réponses qui arrivent dans un délai de 0 à 10 minutes.
Échelle de temps,time_scale,fast_replies,time_scale.fast_replies,Réponses rapides,Réponses dans un délai de 10 à 30 minutes.
Échelle de temps,time_scale,normal_replies,time_scale.normal_replies,Réponses normales,Des réponses qui arrivent dans un délai de 30 minutes à 2 heures.
Échelle de temps,time_scale,slow_replies,time_scale.slow_replies,Réponses lentes,Réponses dans un délai de 2 à 8 heures.
Échelle de temps,time_scale,glacial_replies,time_scale.glacial_replies,Réponses très lentes,Réponses dans un délai de 8 à 24 heures.
Échelle de temps,time_scale,occasional_replies,time_scale.occasional_replies,Réponses fortuites,Des réponses qui arrivent après plus de 24 heures.
Jeu de rôle,role_play,medical_scenes,role_play.medical_scenes,Scènes médicales,"Jeu de rôle dans lequel sont simulés des actes médicaux, des examens et des dynamiques médecin-patient."
Jeu de rôle,role_play,animal_roleplay,role_play.animal_roleplay,Jeu de rôle animalier,Jeu de rôle dans lequel une personne imite le comportement et les manières d'un animal.
Jeu de rôle,role_play,age_play,role_play.age_play,Jeu d'âge,Jeu de rôle dans lequel les participants prétendent avoir un âge différent de leur âge réel (tous adultes).
Jeu de rôle,role_play,prison_scenes,role_play.prison_scenes,Scènes de prison,"Jeu de rôle autour d'un contexte carcéral, souvent avec une dynamique gardien-prisonnier."
Jeu de rôle,role_play,schoolroom_scenes,role_play.schoolroom_scenes,Scènes de classe,"Jeu de rôle en milieu scolaire, souvent avec une dynamique enseignant-élève."
Jeu de rôle,role_play,prostitution_fantasy,role_play.prostitution_fantasy,Fantasme de prostitution,Jeu de rôle dans lequel une personne fait semblant d'avoir des relations sexuelles en échange d'argent ou de faveurs.
Jeu de rôle,role_play,religious_scenes,role_play.religious_scenes,Scènes religieuses,"Jeux de rôle avec des éléments ou des contextes religieux, tels que la confession ou le péché."
Jeu de rôle,role_play,interrogations,role_play.interrogations,Interrogatoires,"Jeu de rôle dans lequel une personne est interrogée, impliquant souvent des dynamiques de pouvoir et de pression."
Jeu de rôle,role_play,fear_play,role_play.fear_play,Jeu de la peur,Activités qui induisent délibérément la peur dans le cadre de l’expérience sexuelle.
Jeu de rôle,role_play,egyptian,role_play.egyptian,égyptien,"Scénarios de jeux de rôle sur des thèmes égyptiens anciens, tels que les pharaons, Cléopâtre, les dieux et la mythologie."
