Category Name,Category ID,Kink ID,Translation Key,Label,Tooltip
أجسام,bodies,skinny,bodies.skinny,نحيف,مهتم بالشخصيات النحيفة أو الرفيعة أو النحيلة.
أجسام,bodies,chubby,bodies.chubby,سمين,مهتم بالشخصيات التي هي أكثر استدارة، ممتلئة الجسم وممتلئة.
أجسام,bodies,small_breasts,bodies.small_breasts,ثديين صغيرين,الاهتمام بالثديين الصغيرين بشكل استثنائي، وفي بعض الأحيان إلى درجة أنهما يبدوان غائبين تقريبًا.
أجسام,bodies,large_breasts,bodies.large_breasts,ثديين كبيرين,مهتمة بالثديين الكبيرين بشكل استثنائي.
أجسام,bodies,small_cocks,bodies.small_cocks,قضبان صغيرة,مهتم بالقضبان الأصغر من المتوسط.
أجسام,bodies,large_cocks,bodies.large_cocks,ذكور كبيرة,مهتم بالقضبان الأكبر من المتوسط.
أجسام,bodies,small_butts,bodies.small_butts,الأرداف الصغيرة,مهتم بالأرداف الصغيرة بشكل خاص.
أجسام,bodies,big_butts,bodies.big_butts,أرداف كبيرة,مهتم بالأرداف الكبيرة بشكل خاص.
ملابس,clothing,clothed_sex,clothing.clothed_sex,ممارسة الجنس مع ارتداء الملابس,المشاركة في علاقة جنسية حيث لا تكون أنت و/أو شريكك عاريين أثناء التفاعل الجنسي.
ملابس,clothing,lingerie,clothing.lingerie,الملابس الداخلية,الاهتمام باستخدام الملابس الداخلية في السياق الجنسي للعب الأدوار، أو الاهتمام بالشخصيات التي ترتديها.
ملابس,clothing,stockings,clothing.stockings,جوارب,الاهتمام باستخدام الجوارب في السياق الجنسي للعب الأدوار، أو الاهتمام بالشخصيات التي ترتديها.
ملابس,clothing,heels,clothing.heels,الكعب العالي,الاهتمام باستخدام الأحذية ذات الكعب العالي في السياق الجنسي لألعاب تقمص الأدوار، أو الاهتمام بالشخصيات التي ترتديها.
ملابس,clothing,leather,clothing.leather,يتعلم,مهتم باستخدام الملابس الجلدية في السياق الجنسي لـ RP، أو مهتم بالشخصيات التي ترتديها.
ملابس,clothing,latex,clothing.latex,مطاط,استخدام مادة اللاتكس و/أو المطاط التي يتم ارتداؤها كملابس.
ملابس,clothing,uniform_costume,clothing.uniform_costume,الزي الرسمي / الزي الرسمي,الاهتمام باستخدام الزي الرسمي أو الأزياء في السياق الجنسي للعب الأدوار، أو الاهتمام بالشخصيات التي ترتديها.
ملابس,clothing,cross_dressing,clothing.cross_dressing,ارتداء ملابس الجنس الآخر,المشاركة في لعبة لعب الأدوار حيث يرتدي أحد الشخصيات أو أكثر ملابس الجنس الآخر.
عام,general,handjob_fingering,general.handjob_fingering,هاند ميد / اصبع,التحفيز الجنسي من خلال الاتصال الجسدي المباشر باليدين أو الأصابع مع الأعضاء التناسلية.
عام,general,oral,general.oral,شفوي,التحفيز الجنسي من خلال الاتصال الجسدي المباشر بالفم أو اللسان مع الأعضاء التناسلية.
عام,general,deep_throat,general.deep_throat,الحلق العميق,اختراق فم شخصية أخرى إلى العمق الذي يدخل فيه القضيب أو الجسم المدخل إلى الجزء الخلفي من تجويف الفم و/أو الحلق، مما يتسبب في بعض الأحيان في حدوث رد فعل منعكس للغثيان، أو تلقي مثل هذه الأفعال.
عام,general,swallowing,general.swallowing,ابتلاع,الاستهلاك عن طريق الفم للسائل المنوي أو قذفه بشكل مباشر أو غير مباشر من العضو التناسلي.
عام,general,facials,general.facials,العناية بالوجه,عملية القذف/القذف مباشرة على وجه شخص ما.
عام,general,face_sitting,general.face_sitting,الجلوس على الوجه,ممارسة جنسية يجلس فيها شخص ما بمؤخرته أو أعضائه التناسلية على وجه شخص آخر، مما يؤدي إلى اختناق الشخص، وأحيانًا إلى حد الاختناق؛ في كثير من الأحيان يتم ذلك كشكل من أشكال إجبار الإشباع الشفهي.
عام,general,edging,general.edging,الحواف,البقاء على حافة النشوة الجنسية دون الوصول إلى النشوة الجنسية.
عام,general,teasing,general.teasing,الأوبئة,يشير إلى مشاهد ممتدة من المداعبة قبل الجماع الجنسي الصريح، والتي قد تكون جسدية و/أو لفظية، وعادة ما تكون لإثارة الشريك إلى حد الإحباط الجنسي أو اليأس.
عام,general,ruined,general.ruined,مدمر,الفعل المتمثل في السماح لشخص ما بالوصول إلى النشوة الجنسية، ولكن إيقاف التحفيز قبل الوصول إلى الذروة مباشرة، مما يؤدي إلى هزة غير كاملة أو غير مرضية. يمكن أن يحدث هذا مع كل من الشركاء الذكور والإناث.
اللعب الشرجي,ass_play,anal_toys,ass_play.anal_toys,ألعاب الشرج,يشير إلى الاختراق الشرجي باستخدام الألعاب الجنسية، بما في ذلك على سبيل المثال لا الحصر، القضبان، والهزازات، والبيض الشرجي، والخرز الشرجي، وما إلى ذلك.
اللعب الشرجي,ass_play,anal_sex_pegging,ass_play.anal_sex_pegging,الجنس الشرجي/الربط,الاختراق من قبل شريك، باستخدام القضيب أو الحزام.
اللعب الشرجي,ass_play,rimming,ass_play.rimming,الحافة,توفير التحفيز الفموي لشرج الشريك عن طريق لعق و/أو اختراق شرج المتلقي باللسان.
اللعب الشرجي,ass_play,double_penetration,ass_play.double_penetration,اختراق مزدوج,اختراق أو استقبال فتحة شرج شخص واحد باستخدام جسمين بما في ذلك على سبيل المثال لا الحصر القضيب، أو الألعاب الجنسية، أو القبضة، وما إلى ذلك.
اللعب الشرجي,ass_play,anal_fisting,ass_play.anal_fisting,قبضة الشرج,إدخال اليد (اليدين) و/أو الذراع (الذراعين) في فتحة شرج الشريك، أو تلقي مثل هذه الأفعال.
تقييدي,restrictive,collar,restrictive.collar,طوق,ارتداء طوق حول الرقبة.
تقييدي,restrictive,leash,restrictive.leash,حزام,يتم قيادته حول المقود.
تقييدي,restrictive,chastity,restrictive.chastity,العفة,الامتناع عن ممارسة الجنس، طوعا أو قسرا؛ وقد يتضمن هذا امتناع الشخص عن ممارسة النشاط الجنسي، أو ارتداء جهاز يمنعه من ذلك.
تقييدي,restrictive,bondage_light,restrictive.bondage_light,العبودية (الضوء),استخدام القيد الخفيف أو المعتدل سواء في الموضع الذي يوضع فيه الشخص المقيد، أو مدة الوقت التي ستبقى فيها الشخصية في القيد، أو مستوى الانزعاج الناجم عن القيد، أو درجة التثبيت التي ستحدث نتيجة للقيد.
تقييدي,restrictive,bondage_heavy,restrictive.bondage_heavy,العبودية (ثقيلة),استخدام القيد بشكل متطرف سواء في الوضع الذي يضع فيه الشخصية المقيدة، أو طول الوقت الذي ستقضيه الشخصية في القيد، أو مستوى الانزعاج الناجم عن القيد، أو درجة التثبيت التي ستحدث نتيجة للقيد.
تقييدي,restrictive,encasement,restrictive.encasement,الحبس,يتم لف الجسم بالكامل مثل المومياء في بدلة لاتكس أو كيس نوم أو معدات جنسية أخرى من أجل الإشباع الجنسي.
تقييدي,restrictive,cag,restrictive.cag,العفة/الأقفاص,جهاز يمنع الوصول إلى الأعضاء التناسلية.
تقييدي,restrictive,blindfold,restrictive.blindfold,عصابة العينين,تغطية العينين لحجب الرؤية، مما قد يؤدي إلى تعزيز الحواس الأخرى وزيادة الشعور بالضعف.
تقييدي,restrictive,breast_bondage,restrictive.breast_bondage,عبودية الثدي,تقنيات ربط محددة تتضمن ربط الثديين، مما قد يزيد من الحساسية ويحفز بصريًا.
تقييدي,restrictive,rope_simple,restrictive.rope_simple,ربط الحبل (بسيط),تقنيات ربط الحبل الأساسية لتقييد الأطراف أو تقييد الحركة.
تقييدي,restrictive,rope_shibari,restrictive.rope_shibari,ربط الحبل (شيباري),فن ربط الحبال الياباني المعقد والجمالي الذي يجمع بين القيود الوظيفية والتعبير الفني.
تقييدي,restrictive,spreader_bars,restrictive.spreader_bars,قضبان التوزيع,قضبان تستخدم لإبقاء الأطراف منفصلة عن بعضها البعض، مما يسهل الوصول ويزيد من الضعف.
تقييدي,restrictive,suspension,restrictive.suspension,تعليق,تقنيات القيد حيث يتم رفع الجسم جزئيًا أو كليًا عن الأرض، مما يخلق إحساسًا فريدًا بانعدام الوزن والاستسلام الكامل.
تقييدي,restrictive,mummification,restrictive.mummification,التحنيط,لف الجسم بالكامل بمواد مثل الغلاف البلاستيكي أو الشريط اللاصق أو اللاتكس، مما يؤدي إلى تثبيت الجسم بشكل شبه كامل.
تقييدي,restrictive,sensory_deprivation,restrictive.sensory_deprivation,الحرمان الحسي,الحد من المدخلات الحسية أو القضاء عليها، مثل البصر أو السمع أو اللمس، لتعزيز الحواس الأخرى وتعميق التركيز.
تقييدي,restrictive,armbinders,restrictive.armbinders,أربطة الذراع,أنابيب خاصة تعمل على تثبيت الذراعين خلف الظهر، مما يسبب تثبيت الذراعين بشكل كامل.
تقييدي,restrictive,cages,restrictive.cages,أقفاص,الحبس في قفص أو زنزانة كشكل من أشكال العبودية وديناميكيات القوة.
تقييدي,restrictive,chains,restrictive.chains,السلاسل,يتم ربطها بالسلاسل، مما يعطي إحساسًا فريدًا بالثقل والبرودة مقارنة بمواد الربط الأخرى.
تقييدي,restrictive,leather_cuffs,restrictive.leather_cuffs,الأصفاد الجلدية,أصفاد مصنوعة من الجلد لربط المعصمين أو الكاحلين.
تقييدي,restrictive,metal_cuffs,restrictive.metal_cuffs,الأصفاد المعدنية,الأصفاد المعدنية التقليدية المستخدمة لربط المعصمين أو الكاحلين.
تقييدي,restrictive,gag_ball,restrictive.gag_ball,بلغاغ,كمامة على شكل كرة توضع في الفم ويتم تثبيتها خلف الرأس.
تقييدي,restrictive,gag_ring,restrictive.gag_ring,حلقة الكمامة,كمامة على شكل حلقة تحافظ على الفم مفتوحًا، مما يسمح بالوصول إلى الفم مع منع الكلام.
تقييدي,restrictive,gag_tape,restrictive.gag_tape,شريط لاصق,شريط لاصق يستخدم لتغطية الفم ومنع الكلام.
تقييدي,restrictive,hoods,restrictive.hoods,أغطية الرأس,تغطية الرأس بالكامل يمكن أن تخلق شعوراً بعدم الكشف عن الهوية أو إزالة الشخصية أو الحرمان الحسي.
تقييدي,restrictive,immobilisation,restrictive.immobilisation,التثبيت,تقييد كامل للحركة من خلال تقنيات القيد المختلفة.
تقييدي,restrictive,leather_restraints,restrictive.leather_restraints,أصفاد جلدية,أصفاد متنوعة مصنوعة من الجلد، تستخدم في أشكال مختلفة من التقييد.
تقييدي,restrictive,stocks,restrictive.stocks,عار,جهاز تقييد تقليدي من العصور الوسطى يستخدم لتثبيت الرأس واليدين.
تقييدي,restrictive,straight_jacket,restrictive.straight_jacket,سترة مقيدة,ثوب خاص مصمم لتثبيت الذراعين عن طريق ربطهما بالجسم.
تقييدي,restrictive,sleep_sack,restrictive.sleep_sack,كيس النوم,كيس خاص محكم يحيط بالجسم بأكمله، يشبه التحنيط.
ألعاب,toys,dildos,toys.dildos,ديلدو,جسم على شكل قضيب منتصب يستخدم للتحفيز الجنسي.
ألعاب,toys,plugs,toys.plugs,المقابس,لعبة جنسية مصممة ليتم إدخالها في المستقيم.
ألعاب,toys,vibrators,toys.vibrators,أجهزة الاهتزاز,جهاز اهتزازي يستخدم للتحفيز الجنسي.
ألعاب,toys,sounding,toys.sounding,السبر,إدخال قضبان معدنية في مجرى البول عند الذكر أو الأنثى، أو تلقي مثل هذه الأفعال؛ من الناحية الفنية، يشير هذا المصطلح إلى قضبان تتردد و/أو تهتز استجابة لبعض أشكال التحفيز، ولكن هذا لا يعني بالضرورة ذلك.
هيمنة,domination,dd_lg_md_lb,domination.dd_lg_md_lb,DD/lg، MD/lb,بابا أو ماما دوم / فتاة صغيرة أو صبي. الأب/الأم هو النصف الأكثر سيطرة في العلاقة، أما الصغير فهو الأكثر خضوعًا.
هيمنة,domination,domestic_servitude,domination.domestic_servitude,الخدمة المنزلية,أن يتم تقديم الخدمة له من قبل كبير الخدم، أو نادلة، أو سائق، أو خادمة، أو مدبرة منزل، أو أن يخدم في مثل هذه الصفة.
هيمنة,domination,slavery,domination.slavery,العبودية,أن يخدم كعبد تحت أمر المهيمن، أو أن يتلقى مثل هذه الخدمة، دون اختيار.
هيمنة,domination,pet_play,domination.pet_play,لعبة الحيوانات الأليفة,اللعب مع الحيوانات الأليفة هو دور يركز على الخاضع الذي يتخذ حالة ذهنية بديلة، غالبًا ما تكون حالة كلب أو قطة أو حصان.
هيمنة,domination,begging,domination.begging,للتوسل,الفعل المهين للذات المتمثل في التسول، باعتباره شكلاً من أشكال الخضوع، والذي يتم دمجه في برنامج التوبة.
هيمنة,domination,discipline,domination.discipline,تأديب,استخدام التعزيز (المكافآت و/أو العقوبات) لتدريب الخاضع على طاعة أوامر السيد المختلفة.
هيمنة,domination,forced_orgasm,domination.forced_orgasm,النشوة الجنسية القسرية,النشوة الجنسية القسرية هي ممارسة جنسية BDSM بالتراضي أو لعب جنسي منحرف حيث يوافق الشخص على إجباره على الوصول إلى النشوة الجنسية بطريقة خارجة عن سيطرته.
هيمنة,domination,orgasm_denial,domination.orgasm_denial,الامتناع عن النشوة الجنسية,يشير إلى حرمان المسيطر من الخاضع للنشوة الجنسية.
هيمنة,domination,multiple_orgasms,domination.multiple_orgasms,هزات الجماع المتعددة,إجبار أو تجربة هزات الجماع المتعددة على التوالي، في بعض الأحيان إلى حد الإفراط في التحفيز أو الإرهاق.
هيمنة,domination,orgasm_training,domination.orgasm_training,تدريب النشوة الجنسية,تدريب الخاضع على المجيء عند الأمر، أو المجيء فقط بإذن المهيمن.
لا موافقة,no_consent,dubious_consent,no_consent.dubious_consent,موافقة مشكوك فيها,الحالات التي يتم فيها التشكيك في موافقة الشريك، على الرغم من أنها لا تشكل اغتصابًا صريحًا.
لا موافقة,no_consent,non_con_rape,no_consent.non_con_rape,غير متعلق بالاغتصاب/الاحتيال,أخذ/أخذ ضد إرادة الشخص، في كثير من الأحيان بالقوة.
لا موافقة,no_consent,blackmail_coercion,no_consent.blackmail_coercion,الابتزاز / الإكراه,يشير إلى استخدام الإكراه و/أو الابتزاز في سياق قصة RP، وغالبًا ما يكون ذلك في شكل وسيلة شبه توافقية للحصول على الجنس من شريك.
لا موافقة,no_consent,kidnapping,no_consent.kidnapping,خطف,اختطاف شخصية في لعبة لعب الأدوار بغرض الاعتداء عليها، غالبًا جنسيًا، أو اختطافها لمثل هذه الأسباب؛ غالبًا ما يعني السجن لأجل غير مسمى.
لا موافقة,no_consent,drugs,no_consent.drugs,المخدرات,استخدام المخدرات غير المشروعة في سياق لعبة تمثيل الأدوار، عادة لتشتيت انتباه الشخصية أو إعاقتها عقليًا، أو لزيادة الأحاسيس الجنسية.
لا موافقة,no_consent,alcohol,no_consent.alcohol,الكحول,استخدام الكحول في سياق لعبة تمثيل الأدوار، عادة لتشتيت انتباه الشخصية أو إعاقتها عقليًا، أو لزيادة الأحاسيس الجنسية.
لا موافقة,no_consent,sleep_play,no_consent.sleep_play,لعبة النوم,ممارسة أفعال جنسية مع شريك فاقد الوعي/نائم.
محرم,taboo,incest,taboo.incest,سفاح القربى,شارك في لعبة لعب الأدوار حيث تكون شخصيتان على الأقل مرتبطتين.
محرم,taboo,age_gap,taboo.age_gap,فارق السن,يشير إلى المشاهد التي يوجد فيها اختلاف كبير في أعمار الشخصيات.
محرم,taboo,interracial,taboo.interracial,بين الأعراق,مشاهد مبنية على التفاعلات بين الأعراق المختلفة دون الاعتماد على الصور النمطية العنصرية.
محرم,taboo,raceplay,taboo.raceplay,لعبة سباق,المشاهد المستندة إلى الصور النمطية العنصرية أو العنصرية، بما في ذلك المشاهد التي تدور في أماكن عنصرية.
محرم,taboo,bestiality,taboo.bestiality,البهيمية,يشير إلى شخصية واعية تقوم بعمل جنسي على حيوان غير واعي، أو تلعب دور حيوان غير واعي في لعبة لعب الأدوار وتقترب منها شخصية واعية.
محرم,taboo,necrophilia,taboo.necrophilia,النيكروفيليا,فعل ممارسة الجنس مع شخصية ميتة، أو فاقدة للوعي أو غير حية، كانت على قيد الحياة ذات يوم، أو من الناحية النظرية، تلقي مثل هذه الأفعال.
محرم,taboo,cheating,taboo.cheating,الغش,حيث يكون أحد الشريكين أو كلاهما غير مخلص لشركائهما.
محرم,taboo,exhibitionism,taboo.exhibitionism,الاستعراضية,المشاركة في لعبة تمثيلية حيث يكون الإعداد عامًا بطبيعته؛ تُستخدم عادةً مع الاستعراض و/أو الإذلال.
محرم,taboo,voyeurism,taboo.voyeurism,التلصص,يشير إلى الحصول على التحفيز الجنسي إما من خلال فعل المشاهدة، عادةً سراً، لشخص (أو أشخاص) يكشفون عن أنفسهم أو يفعلون شيئًا آخر صريحًا، أو فعل الكشف عن الذات و/أو القيام بشيء آخر صريح بقصد مراقبتهم.
السريالية,surrealism,futanari_futa,surrealism.futanari_futa,فوتاناري/فوتا,الشخصيات التي لديها جسد أنثوي بشكل عام، ولكن لديها أعضاء تناسلية أنثوية وذكرية (على الرغم من أن الخصيتين ليست موجودة دائمًا).
السريالية,surrealism,furry,surrealism.furry,فروي,شخصيات حيوانية مجسمة.
السريالية,surrealism,vore,surrealism.vore,ثلم,عملية الاستهلاك الجسدي لشخصية أخرى.
السريالية,surrealism,transformation,surrealism.transformation,تحويل,فعل التسبب في تغيير الخصائص الجسدية للمشارك في لعبة تقمص الأدوار، بما في ذلك الشخص نفسه، بطريقة دراماتيكية من خلال وسائل سحرية أو كيميائية؛ يمكن أن يشير إلى عدد من أنواع التحولات المختلفة، ويشير إلى تلقي المتعة الجنسية من فعل التحول نفسه.
السريالية,surrealism,tentacles,surrealism.tentacles,مخالب,المشاركة في لعبة لعب الأدوار حيث تخترق مخالب واعية بذاتها أو ملحقات تشبه المخالب شخصية ما؛ غالبًا ما ينطوي على اختراقات متعددة.
السريالية,surrealism,monster_or_alien,surrealism.monster_or_alien,وحش أو كائن فضائي,أنواع مختلفة من الوحوش والكائنات الفضائية والشخصيات ذات التحدي الجمالي.
السريالية,surrealism,ghost,surrealism.ghost,روح,كان على قيد الحياة في السابق، لكنه لا يمتلك جسدًا حاليًا.
السوائل,fluids,blood,fluids.blood,دم,متعلق بأخذ الدم أو الحصول على الدم بأي شكل من الأشكال في سياق جنسي، أو القيام بأفعال من شأنها سحب الدم.
السوائل,fluids,watersports,fluids.watersports,الرياضات المائية,يشير إلى فعل أخذ البول، أو إخراج البول، بأي شكل من الأشكال، في السياق الجنسي للعلاقة الحميمة.
السوائل,fluids,scat,fluids.scat,طرد,يشير إلى تناول البراز أو إخراج البراز بأي شكل من الأشكال في السياق الجنسي لـ RP.
السوائل,fluids,lactation,fluids.lactation,الرضاعة,إنتاج الحليب من الثدي، أو ممارسة الجنس مع شخصية تنتج الحليب من الثدي، وعادة ما يكون ذلك استجابة للتحفيز الجنسي، وأي لعب ينتج عن ذلك.
السوائل,fluids,diapers,fluids.diapers,حفاضات,حالة حيث يرتدي أحد الشخصيات على الأقل حفاضات؛ عادة ما يعني هذا أن الحفاضات سوف تكون متسخة بالبول و/أو البراز، وعادة ما يكون ذلك مصحوبًا باللعب مع تقدم العمر أو الطفولة، ولكن في بعض الأحيان يكون ذلك مصحوبًا بالإذلال.
السوائل,fluids,cum_play,fluids.cum_play,لعبة الحيوانات المنوية,أي عدد من المواقف التي تنطوي على اللعب بالقذف.
السوائل,fluids,saliva_spit,fluids.saliva_spit,اللعاب/البصاق,اللعب الجنسي باللعاب أو البصاق.
السوائل,fluids,creampie,fluids.creampie,كريم باي,القذف في شريك والسماح للسائل المنوي بالتسرب أو التدفق للخارج.
السوائل,fluids,cum_on_body,fluids.cum_on_body,القذف على الجسم,القذف على جسد الشريك كنوع من اللعب الجنسي.
السوائل,fluids,cum_on_face,fluids.cum_on_face,القذف على الوجه,عملية القذف على وجه الشريك، أحيانًا كشكل من أشكال الهيمنة أو الإذلال.
الإذلال,degradation,glory_hole,degradation.glory_hole,ثقب المجد,خدمة أو تلقي الخدمة من شريك مع وجود حاجز مادي بين المشاركين.
الإذلال,degradation,name_calling,degradation.name_calling,لعنة,المشاركة في لعبة لعب الأدوار حيث يتم الاعتداء على الشخصية لفظيًا، في محاولة لاستحضار استجابة الإشباع الجنسي من المشاعر المرتبطة بالإذلال، أو مجرد شكل من أشكال الهيمنة النفسية أو العقاب.
